Question Speaker,Question Text,Answer Speaker,Answer Text
Satsvarūpa:,Satsvarūpa:But that's in the books. Not in the public...,Prabhupāda,"Yes. So in such circumstances, of course, we can give. But as far as possible, very cautiously and very rarely we shall present.CaitanyaMahāprabhu's life we see that in public He never discussed about Kṛṣṇa'slīlāwith thegopīs.That was very confidential discussion amongst His own circle,RāyaRāmaṇanda,SvarūpaDāmodara, like that. And He inquired... Even a learned scholar, He discussed about the philosophy, thatSarvabhaumaBhaṭṭācārya. But when there was a great devotee likeRāmānandaRāya, He relishedgopīs',I mean to say, intimate behavior withKṛṣṇa. So we should remember this, that public may misunderstand this. Therefore we have to present these things very cautiously, not very openly. They may misunderstand. But so far this article is concerned, that is nicely written. That is quite in order. So this should be published."
Hayagrīva,There is nothing specificially objectionable?,Prabhupāda,"No, no. There is nothing."
Hayagrīva,"Our process thus far has been to halve up the material about 50-50. He takes half, and I'll take a half, and that seems to be working fairly nicely.",Prabhupāda,"That's all right. But first thing is that when you are in the post of editors, you are supposed to know. But whenever there is some difficulty, either you get it solved by consulting amongst yourselves, or if it is not possible, then refer to me. That's all."
Satsvarūpa:,"Satsvarūpa:Oh. Then I have one question to ask you. What about quoting evenVaiṣṇavaliterature that you haven't translated, like theCaitanya-caritāmṛtaor cantos that you haven't translated? That doesn't seem right.",Prabhupāda,Huh?
Satsvarūpa:,Satsvarūpa:Other translations than your own. What if we want to quote them in some article?,Prabhupāda,Other translations means?
Satsvarūpa:,"Satsvarūpa:Well, sometimes I seeCaitanya-caritāmṛta.Śilavatī even wrote a book about Deity worship, and there's a long quote fromCaitanya-caritāmṛta.I don't know if that's bona fide. I know that the literature is bona fide, but I don't know of any translation that's bona...",Prabhupāda,Caitanya-caritāmṛta?He has written a book? I have not seen it.
Satsvarūpa:,"Satsvarūpa:No. I just mean that devotees, sometimes they write an article and they say, ""As it says in theCaitanya-caritāmṛta,""and they quote a book that they read by some scholar, very goodVaiṣṇavaliterature, but translated by somebody that may not be good.",Prabhupāda,"No. Somebody... So farCaitanya-caritāmṛta,thatNavina-candraRāya... You, mean to say that..."
Brahmānanda,That six volume set? That is all right?,Prabhupāda,That is all right. That is translation. That is all right.
Brahmānanda,"That is the one which is in use, I believe. It's not anything, you know...",Prabhupāda,"That is simply translation. ButCaitanya-caritāmṛtais now presented in ourTLC.Actually that is our conclusion. AndNavinaRāya's translation, there are sometimes little defects, but not very dangerous, not very dangerous."
Hayagrīva,"Should your... In the content, should we put in... How many articles can we put in by you? These are the most important contributions we have, and, say, would it be too much material to put in, say, an essay by you and maybe a lecture or...",Prabhupāda,"Or whatever it may be. That any article may not be more than two, three pages, printed. That will be nice. And if the number of articles are more, how many pages we are going to print?"
Brahmānanda,"Well, there's some discuss... If we print it on our own press we can print it, we could add eight more pages, which would make it forty pages. But we may continue with Dai Nippon inJapan. So I don't know if we'll increase the pages.",Prabhupāda,"So by increasing the pages, what do we immediately get profit? Is there any special advantage we get?"
Satsvarūpa:,Satsvarūpa:More reading material. More reading material. The customer gets more for his money.,Prabhupāda,"That's all right. We should be businessmen. They should get less for their money. (laughter) We are to pleaseKṛṣṇa, not our customers. So if we are not increasing the price, then why should we increase the pages? Either we print in our own press orJapan, there is extra labor, extra energy. But we are not getting extra money. So there is no need."
Satsvarūpa:,"Satsvarūpa:But, Prabhupāda, the point was, can there be more than one article by yourself? Or only one...",Prabhupāda,"No. No. One. One. Everyone one, not more. One man's article, not more than two, either of mine or anyone. But so far our news is concerned..."
Hayagrīva,Not more than two or not more than one?,Prabhupāda,No. Not more than one. Not more than one.
Hayagrīva,You said two or three pages. Maybe four pages would be all...?,Prabhupāda,"Four pages, that's all. But not more than four pages."
Hayagrīva,"There was an excerpt from, I think,KṛṣṇaBook...",Prabhupāda,"No. Whatever is done is done. Now you follow this policy, that one..."
Hayagrīva,What about excerpts from your books? Is that all right?,Prabhupāda,"Oh, excerpt from my book or my article, the same thing. The same thing. So there is no difference. That is also my writing. And whatever you are writing, that is also my writing. So everything is all right. (laughter)"
Hayagrīva,It's all your vibration.,Prabhupāda,Yes. But they should be divided into different names. (laughter) Just like...
Hayagrīva,I have though of doing Bhaktisiddhānta Sarasvatī'sBrahma-saṁhitā.Do you think we could serialize it maybe in three or fourBack to Godheads?Or could we print it ourselves in a little pamphlet? Or which do you think would be better?,Prabhupāda,"No, if you publish inBack to Godhead,then by portion, similarly, three, four pages. That's all, continually, Bhaktisiddhānta's... So when there will be articles sorted, firstGuruMahārāja's, Bhaktisiddhānta's, then mine. Like that. Yes."
Hayagrīva,Yes. Do you think it would be a good...,Prabhupāda,"If you write something, quotation, from Bhaktivinoda Ṭhākura, that should be first. Just likeguru-paramparā,when we offer our respect, first our own spiritual master, then his spiritual master, then his spiritual master. In this way. But when putting article, that should be the opposite. First Bhaktivinoda, then Bhaktisiddhānta, then my, then my disciples, like that."
Kīrtanānanda:,Kīrtanānanda:Why don't you write some purports to that?,Prabhupāda,Huh?
Kīrtanānanda:,Kīrtanānanda:To Bhaktisiddhānta'sBrahma-saṁhitā.It would be nice if you would write some purports to it.,Prabhupāda,Purports?
Kīrtanānanda:,Kīrtanānanda:Yes. Some of us have difficulty understanding BhaktisiddhāntaSarasvatī.,Prabhupāda,"Yes. So if I get time... My time is very limited. So even there is difficulty, let them read over and over and again. Then they will understand. Why should we change it? Let it be presented as BhaktisiddhāntaSarasvatīhas given, and... Then don't give more than one or two pages at a time. Their brain will be puzzled. (laughter) Yes. WhenGuruMahārājawas speaking, at least my brain was puzzled. (laughter) Even he would speak in Bengali, it was very difficult to understand. He was speaking from a very, very high platform. But I wanted to hear him. That's all. Even I did not understand it. That he appreciated, (laughs) that ""This boy does not go away. He hears."" Actually that was my position. In the beginning I could not understand what he was speaking, but I wanted to hear him. That's all. I was very much anxious to hear him. That he marked. And he was kindly pleased on me, that ""He wants to hear. He does not go away."" That was my policy, that ""let me hear. Even I do not understand, let me hear."" That's all. Yes. Actually I did not understand in the beginning what he was speaking. So Bhaktisiddhānta's writing is not very easy to understand. Yes. But we should try, read and read again, and simply that vibration will help us. That's all. It is transcendental vibration, not that everyone will understand. But if you simply give aural reception to the vibration, that will make him advanced, not exactly that anyone has to understand it. Yes. Just like a man is sleeping and somebody is calling him. In his sleeping condition he does not understand. By calling, calling, calling, he gets up because that vibration is there. Not that in his sleeping condition he is understanding what is this sound is coming. So similarly, we should give reception to the transcendental vibrations made byKṛṣṇaand His bona fide representatives. That will make us awakened. Not that we understand everything."
Satsvarūpa:,"Satsvarūpa:Prabhupāda, in editing, there are two different policies about using capitals. One is to use as few capitals as possible or to use many capitals, in grammar capitalized, or to use few. So sometimes yourNectar of Devotionhas got very few capitals. WhenBalarāmais referred to as ""he,"" there is no capital. But the other policy is to always put... Kṛṣṇa's Hands, capital H, Kṛṣṇa's Feet, capital F,KṛṣṇaWho, capital W. Which is...",Prabhupāda,"No, no, no. Don't follow that policy. That will not be very... Then..."
Satsvarūpa:,"Satsvarūpa:The less capitals, the better?",Prabhupāda,Yes. I think. What do you think?
Hayagrīva,"Well, I think, when referring toKṛṣṇa, we should always have a capital ""H.""",Prabhupāda,"Especially. Yes. Especially forKṛṣṇa, you can."
Hayagrīva,"And if we want to, forRādhā, capital ""S.""",Prabhupāda,ButBalarāmais not different fromKṛṣṇa.
Hayagrīva,"So He is capital ""H."" But then here we go. (laughter)",Prabhupāda,"No, no. You limit to these three. That will do."
Hayagrīva,Limit to those three.,Prabhupāda,OrViṣṇu. Yes.Viṣṇu.
Hayagrīva,"What aboutavatāras,in reference to Christ orBuddha?",Prabhupāda,Buddhais capital used. Jesus Christ is capital used.
Hayagrīva,"No, ""He.""",Prabhupāda,No. That you can use...
Satsvarūpa:,Satsvarūpa:Small.,Prabhupāda,Yes.
Satsvarūpa:,"Satsvarūpa:Then words like Kṛṣṇa's ""pastimes,"" ""entourage,"" His ""will.""",Prabhupāda,"No, small."
Satsvarūpa:,Satsvarūpa:Small.,Prabhupāda,Yes.
Hayagrīva,"The possessions ofKṛṣṇa, small.",Prabhupāda,Small.
Brahmānanda,Lotus feet?,Prabhupāda,Yes.
Satsvarūpa:,Satsvarūpa:Lotus flower?,Prabhupāda,Yes. All small. Simply name. Stick to name.
Hayagrīva,"The pronoun,Kṛṣṇa, ""who."" The pronoun ""who,"" that's not...",Prabhupāda,"No, no. Use small."
Hayagrīva,Thank you. There's so many... That causes a headache for everyone.,Prabhupāda,"No. It is better to make everything sound but slow. We want to create this position ofBack to Godheadas very authorized representation of the science of God. In future people may refer to it, so we should very cautiously and very nicely do it. It is very important thing,Back to Godhead.If our movement is going to be recognized as scientific, God consciousness movement, then thisBack to Godheadwill be referred as authorized scripture. So therefore we have to prepare in such a way, nothing non-conclusive can be introduced in this. That should be our policy. And actually it is the position ofBack to Godhead."
Satsvarūpa:,"Satsvarūpa:Oh. Well, this is...",Prabhupāda,Glossary?
Satsvarūpa:,"Satsvarūpa:For theĪśopaniṣad.AndHayagrīvaPrabhuthought that there was too much preaching in the definition. Like, say, in the definition ofbhakti,I shouldn't say,""Bhaktiis the highest form ofyoga."" Well, I don't know if... I'm not speaking your words, but to make it, not to preach more, but I thought that was right.",Prabhupāda,Glossary should be short as possible.
Satsvarūpa:,Satsvarūpa:Short as possible.,Prabhupāda,Yes. At the same time carrying the meaning.
Satsvarūpa:,Satsvarūpa:The conclusion ofVaiṣṇavaphilosophy. That's the absolute meaning.,Prabhupāda,"Yes. It should not be describing the definition. That is not glossary. Glossary should be explained in gist, but the meaning should be carried."
Hayagrīva,"Well, can we use, for instance, the glossary to yourŚrīmad-Bhāgavatamprinted in India, can we use that as a model for...? Is that...?",Prabhupāda,Śrīmad-Bhāgavatam?
Hayagrīva,You have a glossary at the end of the first volume. Is that the type of glossary...?,Prabhupāda,"Yes. I have given glossary. You can follow that principle. Yes. And at the end of each book, glossary, index, will carry weight."
Hayagrīva,"Well, that was fairly terse if I remember, though. That was fairly terse. I mean very short, brief. Definitions were very...",Prabhupāda,"One thing may appear to be very simple and to other, terse, but you do your own duty. Another thing: where is theBhagavad-gītāwith my full translation and synonyms? Where is that manuscript?"
Hayagrīva,I have... There are several existing manuscripts. I have... The manuscript I went over is in Columbus.,Prabhupāda,Whole?
Hayagrīva,The total manuscript is there.,Prabhupāda,"So we have to prepare for next publication, revised and enlarged, giving in the same process: original verse, transliteration, synonyms, and translation, and purport."
Pradyumna,"I've already started that, the first chapter.",Prabhupāda,"Our first printing will be this, what is name?Nectar of Devotion.And then, if possible,Bhagavad-gītāAs It Is,revised and enlarged."
Satsvarūpa:,Satsvarūpa:Īśopaniṣadis even beforeNectar of Devotion.,Prabhupāda,"Yes.Īśopaniṣad.That is already... And thenBhāgavatam.ThenBhāgavatam.And so farKṛṣṇais concerned,Kṛṣṇawe shall print after thisNectar of Devotionin our press if it is printed. But if I get some money, contribution, from George Harrison, then I may get it printed immediately fromJapan. Yes."
Jayadvaita:,"Jayadvaita:There's another manuscript ofBhagavad-gītāalso in New York, the original.",Prabhupāda,Oh. You have got?
Jayadvaita:,Jayadvaita:Yes. It's in New York except for the first two chapters. Everything else is there.,Prabhupāda,"So first two chapters might be withJanārdana. But you have got the whole thing,Hayagrīva."
Jayadvaita:,"Jayadvaita:Some of it has been edited by Rāyarāma, but you can see around it and go to the original behind it.",Prabhupāda,"So whatever is lacking, you ask me. I will supply you."
Hayagrīva,"I would like to see that in going over mine. I'll have to go over it chapter by chapter. But I will compare the version I have with that version, and... I know the translations themselves, they were somewhat changed inBhagavad-gītāAs It Isas it came out in Macmillan. Did you like those translations?",Prabhupāda,"Whichever is better, you think. That's all. You can follow this Macmillan."
Hayagrīva,That was the second... They're good. I think they're very good.,Prabhupāda,"Yes. You can follow that translation. Simply synonyms he can add, transliterations."
Hayagrīva,And we have all the purports. We can include everything. Nothing will be deleted. Everything will be in there.,Prabhupāda,That's all right.
Satsvarūpa:,"Satsvarūpa:Prabhupāda, I have a question and it applies only to me, but it's important. A year ago you wrote me in a letter when I was..., said the editing was going slow, to pay more attention to managing the temple. So...",Prabhupāda,"Yes. Managing, you, why don't you make this Giriraja as the temple manager?"
Satsvarūpa:,"Satsvarūpa:But still... I've already done that. I've made him, but practically I'm still managing anyway. And I madeMurārimanager, but still I'm... I don't spend much time in editing. People are always coming, and I'm running all over the place. I don't edit at all. It makes mesad. I don't...",Prabhupāda,"No, no. They must give relief to you. You can give them instruction, but the actual execution should be done...Pradyumnais there. He can also do. But anyone who is expert in management, he should be... Temple management should not be done directly by you. You can give him policy that ""You do like this."" That's all. Because you have got so many other things to do. Yes. So you create. If there is no expert manager, you create some manager. That is most important thing, to create. To become... (laughs) In our college there was one Mr. Kidd, professor of economics. He was always chastising us. We were student; he was our professor. ""Oh, you cannot have independence. You cannot manage it. You cannot manage. You can work just like ass, but if some asses are given under you, you cannot work."" He was talking like that. ""So don't cry for independence. You are not yet nation."" He was talking like that. So actually his experience was nice, that since the Britishers have gone away, the management of Indian government is not nice. They cannot manage. So he was experienced. He told. I sometimes remember that Professor Kidd told me like that. (laughs) So we have to create nice administrator. That is another function, you see? Every department, we shall create assistant, assistant. So that in case he is ill or he is sick, he cannot work, somebody must work for him."
Brahmānanda,That is how we can expand also.,Prabhupāda,"Yes. Some assistant always must be there, training of assistant. So far your editorial is concerned, you can train. NowPuruṣottama, he can also assist you. Similarly, Gaurasundara can assist you."
Satsvarūpa:,Satsvarūpa:Jayadvaita is already...,Prabhupāda,"Ah, Jayadvaita. So in this way you should create assistant editors also."
Hayagrīva,Thus far Satsvarūpa...,Prabhupāda,That dictaphone can be done in Detroit. That boyBhagavāndāsais here. He has offered service.
Satsvarūpa:,"Satsvarūpa:There's one thing... It seems to be easy, but it's very difficult to hear your voice.",Prabhupāda,"That will require practice. He may commit some mistake in the beginning, but when he is practiced, he will do the right thing. So that you cannot avoid. You cannot change my voice."
Satsvarūpa:,"Satsvarūpa:So just now you've sent aKṛṣṇatape. Should I, rather than do that, give it toBhagavān?",Prabhupāda,"No. First of all test him, who will do that. Test him here, whether he can understand. (break?)"
Brahmānanda,"I also have a dictaphone in New York, Prabhupāda.",Prabhupāda,That is mine.
Brahmānanda,No. I have another one also. I also can have tapes typed.,Prabhupāda,"So that can be distributed, tapes. Yes. In different centers they will have dictaphone and they'll do it."
Satsvarūpa:,Satsvarūpa:And then send me the copy to edit.,Prabhupāda,Yes. Yes.
Hayagrīva,"But before you send them, make a tape, make a recording of them so you can check them over if you want to check them over. 'Cause I don't have time to do that.",Prabhupāda,"Yes. So taping, recording, that does not take much time."
Hayagrīva,No. Somebody can do that for you.,Prabhupāda,You can keep it and record. Yes. So manage in that way. We have to train so many things. So tactfully you have to do that.
Hayagrīva,"Then he does the first editing. After it's typed up off the dictaphone, Satsvarūpa does the first editing. Then I go over what he has gone over and check the manuscript...",Prabhupāda,"Yes. What you do, he goes. And what he does, you go. Then final. In this way. But the last editing should be checked twice. The dictaphone, then checked by him and then by you. Or checked by you and then by him. That's all."
Hayagrīva,Yes. AndPradyumnadoes the Sanskrit after.,Prabhupāda,Yes. That's all. That is printing department.
Hayagrīva,And then Jayadvaita does the composing.,Prabhupāda,Jayadvaita and others.
Satsvarūpa:,Satsvarūpa:PālikāandArundhati.,Prabhupāda,"Now, I heard that you are composing fifty pages daily, altogether?"
Jayadvaita:,"Jayadvaita:No, not fifty pages. The manuscript pages, yesterday we composed about forty manuscript pages.",Prabhupāda,"Correct, all? Complete?"
Jayadvaita:,"Jayadvaita:Yes. The original... It's done twice. So those first pages, the first time, they'd already been done.",Prabhupāda,"No, no. These forty pages, they are complete?"
Jayadvaita:,Jayadvaita:Yes. They are complete.,Prabhupāda,"That's nice. That is encouraging. So even if you complete thirty pages daily, that will be very nice."
Pradyumna,"They'll get faster because ŚyāmadāsīandArundhatiwere just typing fourteen hours a day in Columbus and they were getting at least twenty manuscript pages done, and now it's...",Prabhupāda,"Anyway, you are the in-charge of this composition. You orJaya-govinda? Who is in charge of the composition?"
Jayadvaita:,Jayadvaita:Mostly I am doing it.,Prabhupāda,"Accha.Then you get easily not less than thirty pages daily, complete. That will satisfy. Is that all right?"
Jayadvaita:,Jayadvaita:That's all right.,Prabhupāda,"Yes. Then our books are, biggest book, four hundred pages. So thirty pages daily means, what is that? Within fifteen days you can complete."
Jayadvaita:,"Jayadvaita:Thirty manuscript pages, thirty book pages?",Prabhupāda,Thirty book pages. No. Or what is the manuscript pages? I do not understand.
Jayadvaita:,"Jayadvaita:When it's typed out, we've been doing about...",Prabhupāda,I want complete for being photographed.
Pradyumna,Forty of these.,Prabhupāda,"Oh. All right. These are forty pages. Such, say, in fifteen days how many pages?"
Satsvarūpa:,Satsvarūpa:450.,Prabhupāda,"So you take up twenty days, one month for one book?"
Hayagrīva,I cannot edit much faster than forty pages a day.,Prabhupāda,"No, no. Don't do it, I mean to say, so hastily. But do it slowly and surely. That will be nice. Yes."
Brahmānanda,"One book, one month.",Prabhupāda,"No, that you are printing, that ""one book, one month"" for the last six months. (laughs) That is in theory only. Actually it has not happened. Now do everything solidly so that at least in two months we finish one book. That's all. Is that all right?"
Jayadvaita:,Jayadvaita:Yes.,Prabhupāda,You say everything all right. (laughter) Anyway...
Pradyumna,I didn't edit so many today. I edited fifty yesterday.,Prabhupāda,So I think I want... I shall be very glad to see theNectar of Devotionis finished before I leave this place and you begin some other book.
Jayadvaita:,Jayadvaita:The second part... We've finished the first part. We're now into the second part.,Prabhupāda,"Second part, which second part?"
Hayagrīva,"You want me to doNectar of Devotionand thenKṛṣṇaand thenBhagavad-gītā,in that order?",Prabhupāda,"Yes. So everything is all right,bṛhat-mṛdaṅgadepartment? Majorsaṅkīrtanaparty. They are going,saṅkīrtanaparties in different cities. That is junior. But your, this party, it is senior. You are sitting one place; you have to work thousand times more than them. Yes. You have to edit in such a way. Where is that water?"
Brahmānanda,"It's being offered, Prabhupāda.",Prabhupāda,"All right, all right. That's all..."
Satsvarūpa:,Satsvarūpa:I have a question from the art department.,Prabhupāda,"Art, yes."
Satsvarūpa:,Satsvarūpa:Jadurānī asks are they going too slow? She wants to know are they going too slow. They have thirty pictures ready.,Prabhupāda,"One thing, that Jadurānī should have some assistants. She alone cannot do that."
Satsvarūpa:,"Satsvarūpa:Well, Prabhupāda, you used that word once before, assistant. So then when Jāhnavā saw that letter she said, ""That means I should paint."" So all that assistant meant was that they all painted. And Śāradīyā began to paint. I don't know what you mean by assistant.",Prabhupāda,Assistant means that they should work under her direction. That is assistant.
Satsvarūpa:,Satsvarūpa:And produce pictures side by side with her.,Prabhupāda,"Yes. I give some idea, sketch, and then under that sketch, instruction of Jadurānī, and..."
Satsvarūpa:,"Satsvarūpa:So according to Jadurānī, only she, Muralīdhara,Devahūti, and Baradraj were good enough, that the other weren't good painters, Jāhnavā and Śāradīyā. But I don't know that.",Prabhupāda,"Then they may practice. They may be given to practice, not the actual work. So... But they are scattered in different places."
Brahmānanda,Baradraj is coming to Boston.,Prabhupāda,"Baradraj is good. Yes. He can... If he likes, he can do much work."
Satsvarūpa:,"Satsvarūpa:And Muralīdhara is good and also produces.Devahūtiis good, but doesn't produce.",Prabhupāda,SoDevahūtihas gone. I would have talked with her.
Brahmānanda,Yes. I don't have her address.,Prabhupāda,"Oh, she does not live in the temple."
Kīrtanānanda:,Kīrtanānanda:What aboutMādhava-lati?,Prabhupāda,Yes. She is good painter.
Kīrtanānanda:,"Kīrtanānanda:She's exhibiting a much niceratti... She had asarion today, Prabhupāda.",Prabhupāda,Huh?
Kīrtanānanda:,Kīrtanānanda:She had asarion today.,Prabhupāda,Sari?
Kīrtanānanda:,Kīrtanānanda:Yes. She was wearing asariat the temple. She looks very nice.,Prabhupāda,"No, she is nice. She is talented."
Satsvarūpa:,Satsvarūpa:She could be an assistant painter.,Prabhupāda,"And why not somebody marry her? If somebody want to marry, then she will be all right."
Brahmānanda,Nayanābhirāma wanted to marry her.,Prabhupāda,Then why not ask and get her married? Yes. Then she will be fixed up. I think she requires to be married. Then she will be satisfied.
Satsvarūpa:,Satsvarūpa:One more question from art was...,Prabhupāda,"She is here. I recommend that just ask her to get married. If she agrees, that, what is that boy?"
Brahmānanda,Nayanābhirāma.,Prabhupāda,Let them marry and live here.
Satsvarūpa:,"Satsvarūpa:The other question was, is the subject matter, as they're being done, is there any criticism or should it be changed? The paintings that have been finished thus far, should they be changed in some way?",Prabhupāda,"Then... These paintings are first-class, these paintings."
