Question Speaker,Question Text,Answer Speaker,Answer Text
Brahmānanda,"Is that one first-class there, Prabhupāda?",Prabhupāda,No.
Satsvarūpa:,Satsvarūpa:What's the trouble?,Prabhupāda,"The trouble is that Kṛṣṇa's body is... Why it is made so big? Why the others, inhabitants ofVṛndāvana, smaller?"
Satsvarūpa:,"Satsvarūpa:He's supposed to be up in the front. He's supposed to be in the front, and they're all behind Him. But it mustn't be done well enough.",Prabhupāda,"Well, that is... Do you think that is represented?Kṛṣṇadid not show His gigantic body. As He was, He lifted. Yes."
Hayagrīva,He seems gigantic.,Prabhupāda,Kṛṣṇacould show His gigantic. Actually He expanded His gigantic body. Otherwise how He could lift?
Kīrtanānanda:,Kīrtanānanda:These are very nice.,Prabhupāda,These things are... Yes.
Brahmānanda,"Do you like this one, Prabhupāda?",Prabhupāda,"This is also not bad, but..."
Kīrtanānanda:,Kīrtanānanda:The calf looks like a dog.,Prabhupāda,Huh? Yes.
Satsvarūpa:,Satsvarūpa:So they should be done over.,Prabhupāda,Yes. Yes. This is all right. You see? So you can take some photograph like this picture. This is also...Kṛṣṇais patting a cow.
Satsvarūpa:,Satsvarūpa:That's a good one.,Prabhupāda,Yes.
Brahmānanda,We should just reproduce that as it is?,Prabhupāda,"Yes, why not?"
Hayagrīva,"Gurudāsa has some very excellent pictures from the archives taken from books that were printed several hundreds of years ago,Bhagavad-gītāand some woodcuts ofNṛsiṁha, which would be considered quite artistic, but maybe we can send them to you to see if they meet your approval and maybe reproduce them.",Prabhupāda,"No, whatever card, form, we get, unless we have got arrangement for worship... Of course, we can keep, but our, any form, wooden or stone, that should be worshiped."
Hayagrīva,"These are photographs, these are pictures.",Prabhupāda,"Oh, pictures. Then it is all right. All right. It is all right?"
Satsvarūpa:,Satsvarūpa:Yes. That's all.,Prabhupāda,"That's all. So now distributeprasādam.First of all, chant once moreHareKṛṣṇa. (end)"
