Question Speaker,Question Text,Answer Speaker,Answer Text
Mukunda,"The last thing they said on the program was, ""Perhaps this will give us something to think about for a long time.""",Prabhupāda,"Oh, yes, certainly."
Śyāmasundara:,"Śyāmasundara:No one could deny. They had never seen such a colorful parade, so full of festivity. (Someone walks up to Prabhupāda.)",Prabhupāda,"Oh, I could have gone there. All right. (Sound of washing hands in bowl.) Yes. So I am very glad that you have come and you have takenprasādam.Very nice."
David Wynne:,"David Wynne:Thank you, sir.",Prabhupāda,And we had very good talks also. I'm very glad.
Śyāmasundara:,Śyāmasundara:I'm hoping George will come tomorrow. He has indicated he would come Tuesday.,Prabhupāda,There is basin. You can wash your hands. Wash the dishes.
Śyāmasundara:,"Śyāmasundara:Even at night the sun is shining still. Or rather, the day is night.",Prabhupāda,Here. There is basin. You can wash.
David Wynne:,David Wynne:Yes.,Prabhupāda,I think I am eating more here. (laughter) Is it not?
Trivikrama,. Yes.,Prabhupāda,"I could not eat, in India."
Trivikrama,"Apparently, it's not causing any trouble either.",Prabhupāda,"At least, not yet."
Trivikrama,Not yet.,Prabhupāda,"That means I must have improved. Otherwise, how I am eating? I could not eat."
Śrutakīrti:,Śrutakīrti:No hunger.,Prabhupāda,No hunger.
Śrutakīrti:,Śrutakīrti:India is so hot. It's so hot there you don't want to eat.,Prabhupāda,Yes.
Dhanañjaya,It was a nice talk.,Prabhupāda,Yes.
Dhanañjaya,Sublime.,Prabhupāda,The subject matter is sublime.
Haṁsadūta:,Haṁsadūta:This boy that you were talking to this afternoon is...,Prabhupāda,Now everything is finished. (laughter)
Devotee:,Devotee:He's going around to everyone.,Prabhupāda,What is that?
Devotee:,"Devotee:Would you like to wash your hands, Prabhupāda?",Prabhupāda,I have got. Now you can distribute amongst yourselves. They have been...
Devotee:,"Devotee:This is a nice book,Upadeśāmṛta.",Prabhupāda,You have seen it.
Śyāmasundara:,"Śyāmasundara:If one tries to praise the Creator by, directly, with his ability, what, how does he know what to...?",Prabhupāda,There are so many standard prayers.
Śyāmasundara:,"Śyāmasundara:By his work, I mean.",Prabhupāda,Yes. To glorify God means the glorify the nature also. Just like here is a poem inBrahma-saṁ...
Śyāmasundara:,"Śyāmasundara:So we see in the creation of God, it also traces back to the Creator.",Prabhupāda,"Yes. Creation means the Creator. Just like when I see the picture of so many sculptor. So who has done it? I come to David. To appreciate the creation means you have to come to the point, appreciating the Creator. Otherwise, it is not finished. Or your knowledge is imperfect still. So these scientists, they are simply trying to study the creation. They have no knowledge about the Creator. That is the defect. Neither do they try, neither they can understand. They are so foolish and poor fund of knowledge. They should try to understand the Creator also. Then the knowledge is perfect. Just like the scientists, they are theorizing that life began from matter, chemicals. But wherefrom the chemicals came? That is insufficient knowledge. They say, ""Chemicals existed."" Now, we have no such experience... Just like we ate somepurīs. Purīshad to be created. Not that existed. It is existing, but when I require, I have to create it. The crude example. The chemicals, wherefrom the chemicals came? That is answered in theBhagavad-gītā.In this way you have to study. Simply to study the creation, that is imperfect knowledge. When you come to the Creator, then it is perfect. Just like if you see simply his sculptures, so many things, that is not perfect knowledge. Why this book is ""David Wynne""? Now, you go to the creator. And ...the all appreciation is there, credit is given there. That is perfect. Otherwise, you see, so many stones are there, figures are there. But when you study that ""This is the creation of such and such artist, sculptor, and he's such and such,"" then that is perfect. Study him."
Śyāmasundara:,"Śyāmasundara:Just like by my knowing David, it's very easy to understand his sculpture.",Prabhupāda,Yes.
Śyāmasundara:,"Śyāmasundara:But someone who's just seeing his sculpture, they don't know what...",Prabhupāda,That is not perfect knowledge.
Śyāmasundara:,Śyāmasundara:They don't know what he's like.,Prabhupāda,Yes. That is not perfect knowledge. Perfect knowledge is when you understand the creator. What do you think?
David Wynne:,"David Wynne:I think yes. I'm not sure that the analogy..., I think that the greatest... Well, it is true because with the greatest sculpture, one does get to the full understanding, but if one really understands the universe, well, one would see God, I suppose.",Prabhupāda,No.
David Wynne:,David Wynne:No.,Prabhupāda,You have to penetrate. You have to understand who has created this universe.
David Wynne:,"David Wynne:Yes. Yes. But if a great artist was no longer alive, people would still appreciate...",Prabhupāda,"No, but the God is not like that, no longer alive."
David Wynne:,"David Wynne:No, but that's what I mean. The analogy falls down there, doesn't it.",Prabhupāda,God is not like that.
Śyāmasundara:,Śyāmasundara:But you're saying that it's better to first penetrate and understand God.,Prabhupāda,Yes.
Śyāmasundara:,Śyāmasundara:Then understand the universe.,Prabhupāda,Yes. That is perfect knowledge.
David Wynne:,"David Wynne:And science almost denies the existence of God in order to exist, doesn't it?",Prabhupāda,"That is a rascal. These rascals say like that. Anyone who denies the existence of God, he is rascal number one. Immediately. And anyone, he may be a great scientist or philosopher, let him come. If he says that ""I don't believe in God,"" then I shall prove that ""You are rascal number one."" That I shall prove."
Śyāmasundara:,Śyāmasundara:We'll bring you some scientists.,Prabhupāda,"Yes. So many scientists, psychologists, philosophers came to me."
David Wynne:,"David Wynne:But the greatest scientists have..., are the humblest.",Prabhupāda,"Yes. That is real knowledge, when one becomes humbler: ""Oh, God is so great."" That is real scientist. I think Professor Einstein, he admitted."
Mukunda,"Yes, he said that ""I want to know how God created the universe. Everything else is details.""",Prabhupāda,"Yes. So that means he's still thinking, ""My knowledge is imperfect because I do not know about God."" That is real scientist."
Śyāmasundara:,Śyāmasundara:Just studying one small part of God's creation...,Prabhupāda,"Oh, yes."
Śyāmasundara:,"Śyāmasundara:...is, is...",Prabhupāda,"You see how nicely God has created this flower. How nice artist he is, how he has put the color exactly to the same point. So there is no hand? This is foolishness. It is going on. There is hand of God, but how His hand is working we do not know. That is explained in theVedas:parāsyaśaktir vividhaivaśrūyate[Cc.Madhya13.65,purport].He has got so subtle power that it is working, but we are seeing that it is automatically being done. But He's working. He's working. Just like we work. To paint one flower, we require a brush, color and so many things. Similarly He also requires. But His requirement are supplied so quickly that we see, ""It is being automatically done."" That is the... Because He's so perfect and unlimited that His working capacity we cannot follow. These are explained in theUpaniṣads,that God has no leg, but He can go so fast that nobody can compete with Him. These are the statements theUpaniṣads,that He goes so fast that nobody can compete with Him, nobody can go with Him. That is God's energy. So when it is said, ""God has no leg,"" that means He has no this imperfect leg. He has go..., He has got so perfect leg that nobody can walk with Him. This is the idea. Not that God has no leg. He has got leg, but not this rascal leg. After walking three miles, that's all, finished. (laughter) Not like that. Not like that.Paśyatyacakṣuḥ.He sees, but he has no eyes. These are the statements in theVedas.He has no eyes... Just like we have got eyes, but we cannot see beyond this wall. But He can see everyone's heart, what he is thinking, what he is doing, everything. You cannot hide anything from His seeing.Paśyati.That is, that is His seeing.Paśyatyacakṣuḥ.As soon as we hear something ""seeing,"" immediately understand the relative term that one must have eyes to see. Then when theVedassaysacakṣuḥ,immediately warns that ""Don't think God has got eyes like you."" Because as soon as we think of eyes, we think of our eyes. We cannot think that there can be eyes which can penetrate everywhere. We cannot think of that. And therefore they become impersonalists. Because we rascals, when we think of God's personality, we think of our personality. ""So we are imperfect. Therefore, how God can be person? He must be just opposite."" Imperfect knowledge. They cannot think, these impersonalists, that God is person but all His bodily construction is perfect,sac-cid-ānanda-vigrahaḥ. Īśvaraḥparamaḥkṛṣṇaḥsac-cid-ānanda-vigrahaḥ[Bs.5.1].That Him they cannot think. That means poor fund of knowledge. The impersonalist cannot think that having eyes, how one can see everything all at a time, past, present and future. But that is impossible by us because we have got imperfect eyes. Therefore they conclude, ""No eyes. He must be without eyes."" Imperfect knowledge."
Śyāmasundara:,"Śyāmasundara:So if God is a person with eyes, legs, He stays in one place?",Prabhupāda,"Again, the same... You are comparing with yourself. Because your person can stay in one place only. That means you are simply comparing the Personality of Godhead with your personality. That you have to forget. He, He stays everywhere.Golokaevanivasaty akhilātma-bhūtaḥ[Bs.5.37].Therefore we have to consult the authoritative Vedic literature. This answer is there, thatgolokaevanivasaty,""He is living inGolokaVṛndāvana; still, He is everywhere."" You cannot think of. You are in this apartment. You are not in your office. ButKṛṣṇa, although He's inGolokaVṛndāvana, He's everywhere, in everyone's heart. He's seeing everything. That you cannot imagine, how it is possible. That means you want to compare with your, this foolish, imperfect personality with God's personality. That is our defect. He's distinct from our personality, but He's a person. Yes.Nityo nityānāṁ cetanaś cetanānāmekobahūnāṁyovidadhātikāmān(KaṭhaUpaniṣad2.2.13).He's also a person like us, He's also living entity like us. But what is the difference? He's the maintainer; we are maintained. How many persons you can maintain? A family of two children and one wife, you are embarrassed. And He's maintaining everyone.Ekobahūnāṁyovidadhāti...Innumerable living entities, He's supplying food everyone. He's supplying food the ants within the hole of your room there are thousands of ants. You are not supplying food. How they are getting food? Similarly, you go to the African jungle. There are thousands and millions of elephants. They eat one at a, oh, huge quantity. He's giving food.Ekobahūnāṁyovidadhātikāmān.In the air, within the water, there are so many living entities. In the air there are so many living entities. On the land there are so many living entities. Everywhere. How He's feeding? That is the distinction between God's personality and our personality. We are embarrassed to maintain a family of four, five members, and He is maintaining the whole family of living entities. Not only one planet, there are innumerable planets. And not only innumerable planets, the one universe, then innumerable universes. And these, all these taken together, this is one-fourth creation of God. So three-fourth creation is of the spiritual world. Just imagine how big it is. All of them being maintained by that one. This is the difference. (Someone comes in). Come on.Ekobahūnāṁyovidadhātikāmān.This is the distinction.HareKṛṣṇa."
Devotee:,Devotee:Haribol.,Prabhupāda,"So you can, at any time, visit our temple. You can understand, try to understand the conception of God. We shall try to explain. But we can, at least, so far our knowledge is concerned, we have got a clear conception of God, what is meant by God. Therefore we do not accept the so-called dogs as God. No. So many people come: ""I am God. I am God."" We kick on their face. We don't accept. We don't accept such cheap gods. God is one, and He's all-powerful. That is our conception. We all servants of God. If anyone says that ""I am servant of God,"" he's welcome. He's my master. The servant of God is my master. And if anyone claims to become God, I kick on his face. This is our principle. Because he's pretender, cheater. He should be punished immediately. So you, there are other papers also, published? You have seen? No."
Śyāmasundara:,Śyāmasundara:You saw inside the pictures?,Prabhupāda,Yes. But this picture is very nice.
Śyāmasundara:,"Śyāmasundara:Yes. The other pictures were quite revealing too, because they showed Englishmen and Indian people, foreigners everyone.",Prabhupāda,"Everyone, yes. And they have declared that we have distributed ""freeprasādam."""
Śyāmasundara:,Śyāmasundara:Yes.,Prabhupāda,Yes.
Śyāmasundara:,"Śyāmasundara:""To all and sundry.""",Prabhupāda,Yes.
Śyāmasundara:,"Śyāmasundara:Oh. That's a good idea. We'll try to get the photograph of that, original photograph from the paper.",Prabhupāda,Hm. That will be very nice.
Śyāmasundara:,Śyāmasundara:We can use it in our magazine. Coverphoto.,Prabhupāda,Hm? Yes.
Śyāmasundara:,Śyāmasundara:Make it a coverphotofor a magazine.,Prabhupāda,"""Rival of Nelson."""
Śyāmasundara:,"Śyāmasundara:Yeah, ""A Rival of Nelson."" Just before, maybe two months ago, the boy who was in charge ofRatha-yātrā,Mahā-viṣṇu, we were, he was in so much torment because where was the money going to come from to create such an extravaganza. He wanted to have the best festival ever made. And suddenly he got a letter in the mail: ""Your aunt has died, has left you eight thousand pounds."" (Prabhupāda laughs)",Prabhupāda,Just see.
Śyāmasundara:,"Śyāmasundara:So with that money, he has spent everything forKṛṣṇa, just to glorify Him in that way. He even printed the magazine, everything.",Prabhupāda,His aunt's money has been properly utilized.
Devotee:,Devotee:Do you translate now?,Prabhupāda,What is that?
Devotee:,Devotee:You will translate now?,Prabhupāda,Translation? Yes. Everything is ready. Who has taken thatCaitanya-caritāmṛta?
Śrutakīrti:,Śrutakīrti:Must have beenPradyumna.,Prabhupāda,He has not come back? Why he hasn't?
Śyāmasundara:,Śyāmasundara:Yeah. Make out the form. I'll go right now.,Prabhupāda,First of all phone if they're open.
Śyāmasundara:,Śyāmasundara:Twenty-four hours.,Prabhupāda,Oh. Then that's all right. Then do it. I think you have to pay some money.
Śyāmasundara:,"Śyāmasundara:That's all right. We tried to sell your coin today, but it's only worth three or four pounds.",Prabhupāda,"Well, that's not bad. (laughter) One rupee."
Śyāmasundara:,Śyāmasundara:Yeah. That's not bad for one rupee.,Prabhupāda,Yes. Just like...
Śyāmasundara:,"Śyāmasundara:Prabhupāda has this mint 1935, 1835 rupee piece. Show it to him.",Prabhupāda,Indian rupee.
Śyāmasundara:,"Śyāmasundara:Indian rupee. And we thought it might be pretty valuable. So old, more than one hundred years. We went to three places, they all said three, four pounds.",Prabhupāda,"So highest bid, what was?"
David Wynne:,"David Wynne:Yes, I think, (indistinct)",Prabhupāda,Eh?
Mukunda,"He said if it was in perfect condition, mint condition, then he would give me two pounds. But in this condition, only one pound. He brought out many samples of old rupees with different people on them.",Prabhupāda,You said three pounds?
Mukunda,One man said three pounds.,Prabhupāda,So why don't you sell to them? (laughter)
Śyāmasundara:,"Śyāmasundara:If we tell them... If we go around the city, we could probably get four pounds for it somewhere.",Prabhupāda,So get the best price and sell it.
Śyāmasundara:,Śyāmasundara:All right.,Prabhupāda,I don't want any antique. (laughter)
Śyāmasundara:,"Śyāmasundara:Oh, King William. The British...",Prabhupāda,I think Queen Victoria's father. King William. Is it not?
Śyāmasundara:,"Śyāmasundara:East India Company, it says on here.",Prabhupāda,Yes.
Śyāmasundara:,Śyāmasundara:So the coins were given out by the East India Company.,Prabhupāda,Yes. First of all the Britishers went there as East India Company to have trade connection.
Śyāmasundara:,Śyāmasundara:Disguise. So we should sell it for any price?,Prabhupāda,"Yes. Formerly, people could purchase any amount of coins from the currency."
Śyāmasundara:,Śyāmasundara:From who?,Prabhupāda,"From the currency, government currency."
Śyāmasundara:,Śyāmasundara:Government.,Prabhupāda,"Any amount of coins. In our childhood... Why our childhood? Even when we were young men, the Indians, generally, they like Guinea gold, British Guinea, what is called, pound?"
Śyāmasundara:,"Śyāmasundara:One pound, one shilling.",Prabhupāda,"So in India it was available, any amount. You pay price and take. And they would melt it and make ornament, that Guinea gold. There was no restriction. You can purchase any amount."
Śyāmasundara:,Śyāmasundara:Why all of a sudden it changed?,Prabhupāda,"But, they have lost all gold. There is no gold, simply paper. That's all. Simply blessing, ""Yes, you'll get money."" (laughter) But you'll never get. In the bank also, any amount of gold you can purchase. Bank was canvassing that ""You take gold from us."" I do not know where those gold gone. Nowhere, all over the world, you cannot purchase gold. Even in America."
Śyāmasundara:,"Śyāmasundara:You can purchase some places, but the price is so high for a small amount.",Prabhupāda,"Zurich, you can get."
Śyāmasundara:,"Śyāmasundara:Yes, Switzerland.",Prabhupāda,But you cannot get out with the gold.
Śyāmasundara:,"Śyāmasundara:No, officially not.",Prabhupāda,"Well? Then? Suppose you purchase gold there. If you want to take out, they will not allow."
Śyāmasundara:,Śyāmasundara:Not if they find it.,Prabhupāda,Eh?
Śyāmasundara:,"Śyāmasundara:Officially, no, they will not allow.",Prabhupāda,"And these currency notes, the price, commodity, has gone so high due to this rascal currency. Because your enemy country, they print counterfeit and they overflood in the market. So how you can check it? You cannot check. I know, during wartime, a Chinese man was coming in Calcutta, and he had a purchasing agent who was my friend. So he would come, and he would give a list of goods, especially rare medicines, and he'll deposit with him bunch of notes, ""You spend, purchase, and whatever..."" That means all those notes were counterfeit. (end) ...Greek dictionary, Kristo"
Mr. Wadell:,Mr. Wadell:Kristo...,Prabhupāda,Yes.
Mr. Wadell:,"Mr. Wadell:Well yes,",Prabhupāda,Kristo
Mr. Wadell:,"Mr. Wadell:""The anointed.""",Prabhupāda,"""Anointed,"" yes."
Mr. Wadell:,Mr. Wadell:I understand.,Prabhupāda,"So in India, ordinary men, they callKṛṣṇa""Kristo."" My younger brother, his name wasKṛṣṇa. But we are calling him ""Kristo."" That is ordinary use. So this Kristo word came from India. What is your opinion?"
Mr. Wadell:,Mr. Wadell:I'm sorry. Can you...? Are you asking me?,Prabhupāda,"Yes, Kristo. This is calledapabhraṁśa.Apameans perverted, perverted spelling ofKṛṣṇa."
Mr. Wadell:,"Mr. Wadell:I do not know the true answer to that question, I'm afraid.",Prabhupāda,"And the meaning, anointed. What is the explanation of anointed?"
Mr. Wadell:,"Mr. Wadell:I am not sure whether this was a title applied to him by his disciples or whether it was a title which he himself explained to them, and it makes a difference whether he regarded himself as being anointed... If so he would have said this was by the..., his father.",Prabhupāda,But Kristo is person.
Mr. Wadell:,Mr. Wadell:It is a name applied to...,Prabhupāda,"It is a name, then it must be a person."
Mr. Wadell:,"Mr. Wadell:Yes, that is true. But the name is not always the same as the thing it describes or the person it describes. My name, I have said, is spelled in English in a certain way. It could be pronounced Waddle, Wawdle or, you know what I mean.",Prabhupāda,"No, I am just suggesting there is similarity and the meaning ""anointed."" And from Kristo, the word Christ has come."
Mr. Wadell:,"Mr. Wadell:Yes, in English, that is quite true.",Prabhupāda,"Yes. Now the Christ, what is the meaning of Christ?"
Mr. Wadell:,"Mr. Wadell:I, well, it is this that he is the anointed.",Prabhupāda,"No, Christ means love, something like that."
Mr. Wadell:,"Mr. Wadell:It is connected, I suppose, with the word meaning grace, which is... There is another Greek word which is ""havis.""(?) But I am not a theologian. You know, I am not a brilliant man who understands all the meanings of the words in the Christian faith. But I think the word Christ means anointed, and that it may well be connected with another word which means grace or favor. But I don't think it is the same word.",Prabhupāda,"My idea is that if we can connect this Kristo and Christ, that ""love of Godhead,"" there is some meaning. Because we, ourKṛṣṇaconsciousness movement means we are teaching people how to love God. That is our..."
Mr. Wadell:,"Mr. Wadell:To love is very difficult, is it not? It is very difficult.",Prabhupāda,"No, it is not difficult."
Mr. Wadell:,"Mr. Wadell:Well, it is both difficult and not difficult.",Prabhupāda,"No. Everything, there is a Bengali word,yanrakaryataresaje,anyalokelatibaje.(?) Anything, if one is practiced to do, he can do it very easily. And for others, it is just like striking with a rod.Anyalokelatibaje.Suppose if there is some difficulty in electricity, I do not know anything. It will be very, very difficult task for me. But anyone who knows, immediately he connects two wires, there is light. It is simply to know the art."
Mr. Wadell:,"Mr. Wadell:Yes, I would say with respect, it is easy to feel love for people. It is not always easy to put this love into practice. Sometimes to love, you may have to be hard, apparently hard, to a person if you wish to help them.",Prabhupāda,"The thing is that we want to love people, we want to help them, but if we do not know the process... The same thing, love orhate. That's it. You should know the process how to love. So our process is according to Vedic injunction, thatyathātarormūla-niṣecanenatṛpyantitat-skandha-bhujopaśākhāḥ[SB4.31.14].Just like if you pour water on the root of the tree, automatically the branches, the trees, everything, watered.Prāṇopahārāccayatendriyāṇām.If you supply food to the stomach, the energy is distributed to the hands, legs, eyes, and everywhere. This is the process. But if you take the food and separately push on in the eyes and the ears and the hands and the fingers it is useless."
Mr. Wadell:,"Mr. Wadell:Oh yes, I agree, but...",Prabhupāda,"Similarly, if you try to pour water to each leaf of the tree, it will be simply waste of time. Similarly, God is the root of everything. OurVedānta-sūtrasays,janmādyasyayataḥ[SB1.1.1],Absolute Truth, wherefrom everything has come. So if we love the root, God, then we can love others. Otherwise not possible. Otherwise it is simply waste of time. They have tried. The so-called humanitarian work they have tried. Unity and fraternity and so on, big, big words. But it has not come to... Because there is no love of Godhead, it has failed. Even the United Nations. Central point is missing. So our Vedic injunction is thatsavaipuṁsāṁparo dharmo yato bhaktiradhokṣaje:[SB1.2.6] ""That system of religion is perfect which teaches how to love God."" It doesn't matter, Christian religion,Hindureligion, Mohammedan religion, it doesn't matter. But God minus, this is the present position. Everyone wants to make minus God everything. This is going on. They have no clear idea. If I want to love you, I must have a clear idea of you. On vague idea, I cannot love. But they have no clear idea what is God. So how they can love God? And because they have failed to love God, all the so-called love, humanitarian, philanthropic works and, you know, they have become useless."
Mr. Wadell:,"Mr. Wadell:Yes. The problem is a very big one. We are, perhaps, sent into this earth to know or to learn how to love.",Prabhupāda,"No. I have got some objection. You cannot begin any scientific statement with the word ""perhaps."" (W. laughs) We don't accept. You must be assured, you must be assured."
Mr. Wadell:,"Mr. Wadell:I am merely saying... I do not wish to be presumptuous, if you understand me.",Prabhupāda,"Well as soon as you say, ""perhaps,"" ""maybe,"" that is not... This has no meaning. Because it is not certain. You have no clear idea."
Mr. Wadell:,Mr. Wadell:But are there not things about which in the mortal life one can have no clear idea?,Prabhupāda,"But if there is clear idea, why they should not take it? Why they should speculate ""perhaps,"" ""maybe""?"
Mr. Wadell:,Mr. Wadell:But there are many things about which I cannot have any clear idea. I cannot...,Prabhupāda,"No, you cannot have but if you get clear idea, why you do not take it."
