Question Speaker,Question Text,Answer Speaker,Answer Text
David Wynne:,David Wynne:Yeah.,Prabhupāda,"Yes. You have to learn it. In the conditioned state we act according to ""my whims."" In the liberated state we act according to Kṛṣṇa's whims. That's all. That is the difference. That is the difference. Just see,Bhagavad-gītā.Arjunawanted to act according to his whims, ""Oh, He is going now fight with my grandfather, with my teacher."" These are the problems.Kṛṣṇa... ""No, I cannot fight."" And then at last he agreed to act according to the whims ofKṛṣṇa: ""Yes,kariṣyevacanaṁtava. Naṣṭomohaḥsmṛtirlabdhā[Bg.18.73]."" Find out this verse.Naṣṭomohaḥ.Whatever we are speaking, there is reference in theBhagavad-gītā.We don't speak anything according to our whims. No. Śrutikīrti: There it is. ""I am prepared now to act according to Your whims."" That isKṛṣṇaconsciousness. When he was trying to act according to his whim, the necessity of instruction ofBhagavad-gītāwas there. And when he heardBhagavad-gītā,he's changed. ""Now this is..., all doubts are gone. At last I will act according to your..."" This is... Very important verse. Changing. Changing the whole picture. This isKṛṣṇaconsciousness. SameArjuna, same fighting, same battlefield, everything same, but still everything changed. The consciousness is changed. Externally nothing changed; internally changed. This change is equal for perfection."
Devotee (2):,Devotee (2):So one doesn't have to give up his...,Prabhupāda,"No.Arjunawas a soldier, he was a fighter. The battlefield was there, the war was there, everything was there. He did not... He took toKṛṣṇaconsciousness does not mean he gave up the field and went away. He remained there, but simply the consciousness was changed. He was not willing to fight on his own account. He changed his opinion, ""Yes, now I shall fight. By Your grace, my all doubts are now gone."" This is required, this is perfection. And there's the picture howKṛṣṇais guidingArjuna. When the ranks are formed."
Devotees and David Wynne:,Devotees and David Wynne:Yes.,Prabhupāda,"""Just here. Just here."""
Śyāmasundara:,"Śyāmasundara:Because it went on so long, we didn't stop. [break]",Prabhupāda,"Utilize His mercy. Then your life is perfect. He is ready to help you, from within and from without.Kṛṣṇais so kind. The kindness, the mercifulness ofKṛṣṇa, nobody can repay. In every birth, He is with me, canvassing: ""Why you are acting whimsically? Just turn towards Me."" Therefore He's going along with the living entity in every kind of body, either as demigod's body or hog's body, still,Kṛṣṇais there.Sarvasyacāhaṁhṛdisanniviṣṭhaḥ[Bg.15.15].(pause) Give him someprasāda."
Śyāmasundara:,Śyāmasundara:They said it would be coming any moment.,Prabhupāda,Huh?
Śyāmasundara:,Śyāmasundara:They're bringing someprasāda.,Prabhupāda,"Is there any other paper? No, it is a very impressive picture."
David Wynne:,David Wynne:It's wonderful.,Prabhupāda,"Yes. And they have given, ""A Rival for Nelson."" So this movement is a rival... Days were there in British Empire that Nelson was a hero. NowKṛṣṇais going to be hero in this country. (laughter) It is a good admission, ""A Rival for Nelson."" Actually, He should be."
Śyāmasundara:,Śyāmasundara:I never heard of him.,Prabhupāda,"Lord Nelson, he fought the Spanish battle, I think."
David Wynne:,David Wynne:I don't know.,Prabhupāda,"He died, but became victorious. Yes. I think during Queen, last Elizabeth's time, or something...?"
David Wynne:,"David Wynne:Yes. The last words: ""England expects that every man this day will do his duty."" And all that. He was a hero because he died young, I think.",Prabhupāda,"Maybe. I do not know. But Nelson, Lord Nelson, was famous man, soldier."
David Wynne:,"David Wynne:I have just come from Morocco. I've been with the King of Morocco, who is... It's very strange because he is an absolute ruler, and when an ordinary man is an absolute ruler, it's rather dangerous.",Prabhupāda,"No. If the man is really Kṛṣṇa's representative, then it is all right."
David Wynne:,"David Wynne:Yes, he prays five times a day. He's a Moslem.",Prabhupāda,"That king should be a representative of God. That is ideal king. But if he thinks that ""This kingdom is my property, and let me enjoy for my sense enjoyment,"" then it is all gone. If he thinks himself as representative of God... Just like we think. Therefore we are after our disciples: ""Do this, do that, do that, do that."" We want to see that my disciples also becomeKṛṣṇaconscious. Similarly, it is the king's duty to see that every citizen becomes God conscious. Then he is representative of God. That is the first duty. The division must be there, and the, it is the duty of the king to see that everyone is discharging according to his responsibility. That is king's duty. Abrāhmaṇais acting exactly likebrāhmaṇa.Thekṣatriyais acting exactly likekṣatriya.Avaiśyais... Like that. It is the duty of a king to see that nobody's unemployed, everyone is engaged in his own occupational duty. That is the... And they must feel security of life, property, anxiety. That is perfect king. Here, at the present moment, nobody is confident whether he'll live after an hour or... You see. Anyone can take your property and life, at any moment. There is no protection. There is no protection. And so far anxiety, there is no length and breadth. People are always full of anxieties. Unemployment. These things should not be there. No unemployment, no anxiety, no feelings of insecurity. And that is good government. Nowadays there are police force. But what is the use of this police force? You go on the street, somebody stabs you, what police can do? If somebody takes away your money from your personal pocket, what the police can do? They'll take some note."
Śyāmasundara:,"Śyāmasundara:That's right. If ...one boy who stole from us, I told the police. We told them exactly where he was, at the airport, Manchester. ""He's going on flight such and such to America tomorrow."" Plenty of time to apprehend him. They didn't do anything.",Prabhupāda,Just see.
Śyāmasundara:,"Śyāmasundara:They came... Oh, they sent one inspector to take notes.",Prabhupāda,That's all.
Śyāmasundara:,Śyāmasundara:Many notes.,Prabhupāda,"Useless, all... And taxation. No security and ninety-nine per cent taxation. Just see the fun. They are very much accurate to take taxation. And there is no guarantee of security. This is the position."
David Wynne:,David Wynne:Has it ever been perfect?,Prabhupāda,Eh?
David Wynne:,David Wynne:Has it ever been on earth in the material world perfect with...?,Prabhupāda,Oh yes.
David Wynne:,David Wynne:It has.,Prabhupāda,"Five thousand years ago, it was all perfect. The whole world, this planet, was being ruled by one king. And they were all happy. That is in the history. Five thousand years ago. Maybe less, in three thousand years ago the history was different. The difficulty is that as soon as one is lost of his culture, he becomes an animal.Dharmeṇahīnāḥpaśubhiḥsamānāḥ.That is the difference between human being and animal. Human being must be with culture. Animal cannot be cultured. So a human being without culture, he's no better than animal. That culture is lost. They have missed the aim of life."
Revatīnandana:,Revatīnandana:They think they have culture.,Prabhupāda,"What is this culture? A human being is killing so many animals, innocent animals, is that culture? They are less than animals. Who kills? The tiger kills, ferocious. A human being killing innocent animals... In Christian religion, therefore: ""Thou shall not kill."" But they are killing only. Where is the culture? Killing culture. That is not culture. What do you think?"
David Wynne:,David Wynne:It must be so. Yes.,Prabhupāda,"Yes. How a human being can kill another human being or another animal unnecessarily? And if you kill, there is law, life for life. But they have made laws for human beings. When an animal is killed, he's not criminal. But in the God laws you cannot avoid that. If you have killed an ant, you must be shot. That is God's law. You can avoid man-made law, but you cannot avoid God-made law. That you cannot do. You must be responsible. If you kill an ant even without knowledge, you are responsible. Such subtle laws are there. So we must know our responsibility. Without knowledge, if we kill, we are responsible. And with knowledge, there is no question. Where is that culture? They advertise, ""Live and let live."" What is that? Do they do that? Actually? They want to live at the expense of others. Why not let live others? Where is that culture?"
Śyāmasundara:,"Śyāmasundara:Now there is a famous cinema being shown called ""Live and Let Die.""",Prabhupāda,That is good culture. Yes.
Śyāmasundara:,Śyāmasundara:Favorite. Everyone likes it.,Prabhupāda,Yes. Let others die; you live.
David Wynne:,"David Wynne:And yet,Arjunahad to fight in the war, didn't he?",Prabhupāda,Hm?
David Wynne:,"David Wynne:In theBhagavad-gītā,he still had to... But it didn't matter him killing if it was Kṛṣṇa's responsibility?",Prabhupāda,"No. Fighting or killing, when it is done for, under the guidance ofKṛṣṇa, that is a different thing."
David Wynne:,"David Wynne:Yeah, I see.",Prabhupāda,"Just like a soldier fights on behalf of the king, and the more he kills, he gets medal. The same soldier, as soon as kills one man, he's hanged. He cannot say, the soldier, that ""In the battlefield I killed hundreds and hundreds men and I was rewarded. Now I have killed only one man, I am being hanged? What is this?"" Why? He's hanged. Because he killed on his own account."
David Wynne:,David Wynne:There's the thing.,Prabhupāda,And in the battlefield he killed on the state's account. He was rewarded. So there is difference between killing.
David Wynne:,David Wynne:Yeah.,Prabhupāda,"When there is real, righteous fight, for good cause, that fighting is all right. Just like the state gives punishment one person, ""This man should be hanged. Kill him."" So who is blaming the state, ""Oh, the state is killing this man?"" That is right. It is good for him. InManu-saṁhitāthere is good background. So similarly, everything is good when it is done for the good. And God is good. That isKṛṣṇaconscious move... And everything is bad when it is done formāyā.That's all. So these wars are declared not for Kṛṣṇa's sake; by the politicians' whims. So they must be responsible for this war."
Śyāmasundara:,"Śyāmasundara:Like the Vietnam, you mean?",Prabhupāda,"Any, any war. They create whimsical... Anything you do whimsically, you are responsible. Anything you do. Why fighting? Anything."
Śyāmasundara:,"Śyāmasundara:Yeah. It's funny that that John F. Kennedy, he started that Vietnam war, and he was shot down later.",Prabhupāda,He started that war?
Śyāmasundara:,Śyāmasundara:Yeah.,Prabhupāda,What is the position now? Nixon? He's going to be impeached? Yes.
Śyāmasundara:,"Śyāmasundara:Practically, he is, without...",Prabhupāda,He's cornered now.
Śyāmasundara:,Śyāmasundara:Yeah. He's lost all respect.,Prabhupāda,"Prestige. Still if he sticks to his position, that is his foolishness. He should have resigned. If, if... Upright man: ""All right, you do not like me. I resign."" Then whole thing would have been quashed off. But he's a foolish man. He's sticking to his position."
Bhagavān,"Prasādamwill be here in a few minutes. Our position, I guess, is just to make it an easy choice for people.",Prabhupāda,Yes.
Paramahaṁsa,To come toKṛṣṇaconsciousness.,Prabhupāda,"But choice means, a child cannot be given for choice. He must be forced. Right child is a rascal. So you cannot give him choice. He must do it. That's all."
Revatīnandana:,"Revatīnandana:Or like, like our festivals.",Prabhupāda,Yes.
Revatīnandana:,Revatīnandana:To make it easier.,Prabhupāda,"It is very nice. It is, what is called, nonviolent. We ask everyone, ""Come and join."" You saw our procession yesterday?"
David Wynne:,"David Wynne:No, I didn't. I wasn't there.",Prabhupāda,"I see. Many thousand people joined us. From two o'clock up to eight o'clock. Six hours. At last, the police had to ask them to go away. Is it not? Who told me that? Eh?"
Mukunda,I didn't know. I know they were...,Prabhupāda,"They were not leaving Trafalgar Square. So it is a very nice movement, very serious movement. You are known to so many big, big men. Try to induce them to understand this serious movement. If leading takes something seriously, others follow."
David Wynne:,David Wynne:Yeah.,Prabhupāda,"Yes. At the present moment, the world situation is not very good. And it will deteriorate more and more if they do not take toKṛṣṇaconsciousness or God consciousness. When I speak ""Kṛṣṇa,"" that means God."
David Wynne:,David Wynne:Yeah.,Prabhupāda,What is your idea of God?
David Wynne:,David Wynne:Everything.,Prabhupāda,Hm?
David Wynne:,"David Wynne:It seems... I, I mean I, I don't know. I've thought of it, of course, many times as every intelligent person has, but it's, my idea of God is on the consciousness of the whole world, of all that we could possibly envisage, its consciousness is, that's God, and we're the little bits of it. But would you tell me...?",Prabhupāda,"Complete in everything. That is the conception of God. Complete in power, complete in knowledge, complete in beauty, complete in opulence... Everything complete. That is the conception of God. Everything complete. There is no scarcity. Everything complete, unlimited. So what is your idea of this material creation? Material means so much land, so much water, so much air, so much fire. So who created these things?"
David Wynne:,"David Wynne:Well, God created it, and it seems to be the aspect of God that we are attached to.",Prabhupāda,Eh?
David Wynne:,"David Wynne:(laughs) But I'd rather you told me, sir.",Prabhupāda,What is that?
Śyāmasundara:,"Śyāmasundara:This material world is like an aspect of God that we are attached to, but the God behind we don't know.",Prabhupāda,"Yes. That is our foolishness, that we do not know that behind this material cosmic manifestation, there is God. That information we get fromBhagavad-gītā. Mayādhyakṣeṇaprakṛtiḥsūyatesa-carācaram[Bg.9.10].That means this cosmic manifestation is creation of God. The vast water is created by God. The vast land is created by God. Everything is created by God. Do you believe that?"
David Wynne:,David Wynne:Yes.,Prabhupāda,"That's nice. So if everything is created by God, then, when you create something, is it your property or God's property?"
David Wynne:,"David Wynne:Oh, God's.",Prabhupāda,That's it.
David Wynne:,David Wynne:Yes. But it feels like it when one creates it. One's surprised and didn't know what it was going to be like and cannot claim it.,Prabhupāda,No. God supplies the ingredients. That just like you are working on stone. So who has supplied the stone?
David Wynne:,"David Wynne:Yes, this I can understand because it's...",Prabhupāda,"Yes. Then you are working on the stone with your intelligence, but who has supplied you the intelligence? You are working with your hand, but who has supplied you the hand? In this way, if we consider that everything belongs to God; therefore the result must be given to God. This isKṛṣṇaconsciousness."
David Wynne:,"David Wynne:Sometimes one gets in the way. Sometimes one, when one's own wishes intrude, one can spoil what's being made by trying to put one's own ideas at the wrong time. But at other times, even with somebody who's as bad at it as me, the, something else does come through, doesn't it? The, the, what should be there if one senses and stands back and lets it come.",Prabhupāda,What is that? Sometimes it is not successful?
Śyāmasundara:,"Śyāmasundara:When we try artificially to impose our idea on something, say, a sculpture, sometimes we make a mistake and it comes out not good.",Prabhupāda,That mistake you are responsible.
David Wynne:,David Wynne:Yeah. Yeah.,Prabhupāda,"Because at the present moment, as I told you, we are acting according to our whims. So if there is mistake, I am responsible."
Śyāmasundara:,"Śyāmasundara:In, in,... Sometimes they call inspiration... They say, ""Oh, I've been inspired,"" and they create something beautiful by, automatically almost. What is that inspiration?",Prabhupāda,"That inspiration means you created an idea, that ""I want to do like that,"" and because you are persistent to act, so God helps you, ""All right, you act."" That is inspiration. But you are responsible. God gives you... You are persistent, that ""I must have it."" ""All right, do it."" That is inspiration. We should not do that. Unless it is desired by God, we should not act anything. That isbhakti. Anyābhilāṣitā-śūnyaṁjñāna-karmādy-anāvṛtam,ānukūlyenakṛṣṇānuśīlanam... Anyābhilāṣitā-śūnyam[Brs.1.1.11].You should not have any (indistinct) for your satisfaction. Then it is all God's responsibility.Jñāna-karmādy-anāvṛtam[Cc.Madhya19.167]."
Śyāmasundara:,Śyāmasundara:What if there's some desire to make something beautiful to give toKṛṣṇa?,Prabhupāda,Hm?
Śyāmasundara:,Śyāmasundara:If one wants to be ...,Prabhupāda,"Well,Kṛṣṇawill accept not from any ordinary man, unless you are devotee. If you think that ""I shall do something forKṛṣṇawithout having any relationship withKṛṣṇa,"" howKṛṣṇawill accept it?Kṛṣṇaaccepts only from the devotee. He does not accept anything from anyone else. He's not in want."
David Wynne:,"David Wynne:Yes, exactly. (laughs mildly)",Prabhupāda,"He's not in want. He's complete in Himself. But when a devotee gives Him love and faith, He accepts: ""All right. Thank you."" That is another thing. Otherwise, He doesn't require anything from him. What beautiful thing you can give toKṛṣṇa? He can create thousand times beautiful thing than you... What power you have got? Why should you desire like that? But if you are devotee, either it is beautiful or ugly, it doesn't matter. If you give toKṛṣṇain good faith, He'll accept it. It doesn't matter. That is stated in theBhagavad-gītā.Patraṁpuṣpaṁphalaṁtoyaṁyo mebhaktyāprayacchati[Bg.9.26].He doesn't require anything. Butbhaktyā,in devotion and love, if anyone offers even a little leaf, a little flower,tadahamaśnāmi,""I accept."" He says. A little flower and little leaf, what benefit you'll do toKṛṣṇa, unlimited? But He says, ""Still, I accept because it is offered in faith and devotion."" So that is a different thing."
Śyāmasundara:,"Śyāmasundara:It's funny, too. When David went to see the Queen one day, he took fifteen of our small rubies. They're not worth much compared to her crown jewels...",Prabhupāda,"Oh, yes. Certainly."
Śyāmasundara:,"Śyāmasundara:But he told her that they were like... She said, ""Well, what shall I do with them?"" And he said, ""Well, they are... Consider them, Your Majesty, like flowers offered to you by one of your subjects."" And she became very pleased to see it like that.",Prabhupāda,"Yes. What, what is the value of those jewels to her? But if some citizen offers in good faith and love, she accepts. That's all."
David Wynne:,"David Wynne:Is it right thinking to think that one, although one can't give anything...Kṛṣṇa, of course, has everything. Should one not praise Him? Because...",Prabhupāda,"No, no. You should praise Him, certainly. That isbhakti.That isbhakti.Yes."
David Wynne:,David Wynne:Because what I...,Prabhupāda,"Bhaktyāmāmabhijānātiyāvānyaś cāsmitattvataḥ[Bg.18.55].(People enter room, pause, moving tables, etc.) Takeprasādam.Prasādaṁprāpti-mātreṇabhoktavyam.(""Prasādamshould be eaten as soon as one obtains it."") Take."
Śyāmasundara:,"Śyāmasundara:You must be hungry after all that hard work. (Eating, etc.)",Prabhupāda,This ishalavā?
Śyāmasundara:,"Śyāmasundara:Yeah, it's bananas and cream. Everything.",Prabhupāda,Hmmm.
Śyāmasundara:,Śyāmasundara:The cream in England is excellent. (pause) [break],Prabhupāda,"So if the monarch becomes ideal, it will be very nice."
Śyāmasundara:,"Śyāmasundara:There is still a feeling... In all other countries, everyone thinks, ""I can become the leader. I can become president."" ""I can become prime minister."" But in this country, everyone still must think, ""I cannot become the king. I cannot become the queen."" The king is something higher.",Prabhupāda,Oh yes.
David Wynne:,David Wynne:That's all right.,Prabhupāda,Yes.
David Wynne:,"David Wynne:Because one sometimes feels that one isn't, doesn't know enough about it to do this, you know.",Prabhupāda,Or better than that is to praise the Creator.
Devotee:,Devotee:This sculpting is such a nice art. You're very fortunate to have such a skill.,Prabhupāda,"You can... (Prabhupāda is eating) Horrible. ...carve so many pastimes of God, Kṛṣṇa's. In India, the sculptor used to do like that."
David Wynne:,"David Wynne:There's no great art that isn't religious in the world, that isn't to do about God. Because art about man is already debased, isn't it. Yes, must be. But I feel that if one even me, even people like me, the ordinary people making ordinary things, if they're, if it is praising nature... Because nature's an aspect of God, isn't it.",Prabhupāda,Yes.
David Wynne:,"David Wynne:And a pure one. Not, not spoiled. Anyway, that's what I tell myself. (laughs) What I mean is, if one makes a bird, if it has the feeling that becauseKṛṣṇabreathed life into it and made it, and if one can reproduce this and get the spirit of it, that's praising...",Prabhupāda,"Yes, that is also indirect praising. But you can praise Him directly."
Śyāmasundara:,Śyāmasundara:I think part of the trouble with our modern age is that no one has any information about God.,Prabhupāda,They do not know what is God.
Śyāmasundara:,Śyāmasundara:They can't praise Him directly because they don't know what He looks like or what He does. (Prabhupāda is still eating.),Prabhupāda,"What is this, behind thehalavā?"
Śrutakīrti:,Śrutakīrti:Behind it?,Prabhupāda,"Hm? Something is coming out, white?"
Śrutakīrti:,"Śrutakīrti:Oh, they probably put cream in it.",Prabhupāda,Oh.
David Wynne:,David Wynne:Very good. Thank you. Lovely.,Prabhupāda,So how do you like our philosophy?
David Wynne:,David Wynne:How do I like...?,Prabhupāda,Our philosophy.
David Wynne:,"David Wynne:I, I like it, I admire it very much. I don't know...",Prabhupāda,Thank you.
David Wynne:,David Wynne:I don't know very much.,Prabhupāda,"I know, you, you, in one day or one minute, how can you know? But our basic principles of philosophy."
David Wynne:,David Wynne:Yeah. I've been... I was more or less brought up... My mother told me when I was very small that theBhagavad-gītāwas the most important book in the world.,Prabhupāda,Oh!
David Wynne:,David Wynne:And theUpaniṣadsand theVedasand the...,Prabhupāda,"Oh, you are fortunate."
David Wynne:,"David Wynne:So I've always known that it was true, but one, one's knowledge is very shallow. It's always felt true, is what I mean. Because anarti..., you know, a sculptor goes more by feeling than by thinking, you know.",Prabhupāda,"Sometimes in your, by your convenience you can come to our temple and see how they are executing devotional..."
David Wynne:,"David Wynne:Hm. Also one can tell a little bit about your teaching by the people one knows who were taught. I knowSamand I know George, and they've changed. George has grown much more, much more than the others. But I knew them when they were very young, you know.",Prabhupāda,Aiye.
David Wynne:,David Wynne:And George now has gained enormously in spiritual steps.,Prabhupāda,He's a very intelligent boy.
David Wynne:,David Wynne:Oh yes. But he now is wise as well as just clever.,Prabhupāda,He's fortunate.
David Wynne:,"David Wynne:And so, from this I think...",Prabhupāda,No. Śyāmasundara has tried his utmost to convince him aboutKṛṣṇa.
Śyāmasundara:,"Śyāmasundara:He said, ""Other religions... [break] ...come for a short time."" (Breaks in tape)",Prabhupāda,"Give him little, some morepurīs."
Śyāmasundara:,Śyāmasundara:...and something to wash hands in. (door closes),Prabhupāda,"No, he's bringing. You can take."
Śyāmasundara:,"Śyāmasundara:David has said that he would like to spend some time, a day or something, making also your form into stone. Is that...? Or into some metal. Is that all right?",Prabhupāda,"Well, what I am? I am insignificant. I have no objection. Our, some of our artists may paint this picture. I liked it very much. (Probably speaking of picture ofRathacart in the Guardian newspaper)"
Śyāmasundara:,Śyāmasundara:Very clever person who has thought up this idea.,Prabhupāda,No other publication?
Śyāmasundara:,"Śyāmasundara:I didn't see the newspapers today. I saw two or three, but on Sunday the reporters do not work. So if they were reporters coming, they came outside of their work hours. Some... I heard on television last night, though, there was a half hour program.",Prabhupāda,Oh.
Mukunda,Yeah. On the news they had a long sequence.,Prabhupāda,You have seen?
Mukunda,"No, Ranchor said it was very first-class.",Prabhupāda,Oh.
Śyāmasundara:,Śyāmasundara:They glorified the whole parade on television. They didn't make fun of it or like that.,Prabhupāda,Nobody should make fun.
Śyāmasundara:,"Śyāmasundara:It wasn't just an objective report, but they said it was good, it was nice, and had good appeal.",Prabhupāda,"Yeah, everyone appreciated."
