Question Speaker,Question Text,Answer Speaker,Answer Text
Mr. Wadell:,"Mr. Wadell:Oh yes, I'm not claiming... I haven't any claim to goodness. You must understand that.",Prabhupāda,"Similarly, any living entity, any living entity who is originally part and parcel of God, God is all-good, therefore the part and parcel of God is also all-good. But as soon as comes to the material world, he [break] As exactly like the same, that as soon as one is put into the prison wall, within, he is a criminal. Now he has to undergo the criminal laws. Similarly, because we have come to this material world, we have to undergo the material tribulations. We cannot avoid."
Mr. Wadell:,"Mr. Wadell:Well this is a very long... We are now on a topic on which I should have to require or ask, if I put it more politely, much more time than I have. Now, I am a person with responsibility to my boys. I must go now and say our prayers in the Christian way, which...",Prabhupāda,"Yes, that's nice."
Mr. Wadell:,"Mr. Wadell:...Well, we profess up there, which not all believe, but some do, and they must be given their chance. (laughs)",Prabhupāda,"Oh, yes, that is nice."
Mr. Wadell:,Mr. Wadell:Will you please excuse me at this moment. I would very much like to come back and pursue this.,Prabhupāda,"Yes, you come often. Yes, you are welcome. Yes."
Mr. Wadell:,Mr. Wadell:If you feel it is of any interest or value to you.,Prabhupāda,"Oh yes, yes, After 4 o'clock you can come. You are welcome."
Mr. Wadell:,"Mr. Wadell:Yes, well, we have a very busy week, because, as I say, we are correcting papers, we are ending our term.",Prabhupāda,"Oh, yes, you must be busy."
Mr. Wadell:,"Mr. Wadell:But what we are talking about is something which doesn't change from today or tomorrow or yesterday. So when these things have been done, perhaps next week, I will come down.",Prabhupāda,"Oh, yes, you are welcome. I want that responsible persons like you should try to understand the scientific value of this movement. It is not a sentimental movement. It is based on philosophy, science, authority."
Mr. Wadell:,"Mr. Wadell:Well, it's on this question of authority, in a sense, that we would have the greatest difficulty. But another time, please.",Prabhupāda,"Well, every religion is authority. That's a fact."
Mr. Wadell:,"Mr. Wadell:It is, yes. That's true. But every individual is free and must find for themselves.",Prabhupāda,"No, we, we... Our proposition is, our proposition is thatsavaipuṁsāṁparo dharmo yato bhaktiradhokṣaje[SB1.2.6].""That is first-class religion which teaches the followers how to love God."" This is our proposal."
Mr. Wadell:,"Mr. Wadell:Well, we shall see. We have a lot to... (laughs) It is quite possible that I too have been sent.",Prabhupāda,"Yes. Give him someprasāda.Just wait little. Takeprasādam.Our only fighting is against atheism, godlessness. This is our main fight."
Mr. Wadell:,Mr. Wadell:I agree.,Prabhupāda,"Yes. People say, ""There is no God, God is dead. This is all humbug."" And so many there are, atheistic proposals. We are giving fight against this atheism."
Mr. Wadell:,"Mr. Wadell:Oh, no, no, I must. I have my boys. They wait for me and I must be with them. (laughter)",Prabhupāda,There is someprasādam.
Śyāmasundara:,Śyāmasundara:He is teacher just down the road in the school.,Prabhupāda,You take little this. Yes. Just take little.
Mr. Wadell:,Mr. Wadell:May I take just.,Prabhupāda,Just little. I am not giving you much. (lots of laughter)
Mr. Wadell:,"Mr. Wadell:Oh, it's very good. Just a little.",Prabhupāda,"It is very good, tasteful."
Mr. Wadell:,Mr. Wadell:Thank you.,Prabhupāda,All right. (end)
Guest (2):,"Guest (2):Another one,GuruMaharajaji, they are taking our picture and selling all Christian books as religion education, moral education. And this is the tools. These people little cunning, eh? When it comes to my knowledge, I was almost...",Prabhupāda,HareKṛṣṇa.
Guest (2):,Guest (2):HareKṛṣṇa. And they are selling all these Christian books in the schools and all over.,Prabhupāda,Wherever. This is our advertisement.
Guest (2):,Guest (2):Advertisement...,Prabhupāda,Demonstration of world religion.
Guest (2):,Guest (2):World religion.,Prabhupāda,This is world religion.
Guest (2):,"Guest (2):But what inside... (showing pamphlet or something) They say religion and moral education books, and all this... So actually, they should take our permission also. So this will sell our books. Our organization, not theirs, controlling the people.",Prabhupāda,"No, they are taking."
Guest (2):,"Guest (2):Religious people are recognizing that this is very important. They say ""the world religion,"" and this is the tool. They say, well, the tool. ""Here is the new tool for religion education in the secondary schools."" So they are recognizing this fact.",Prabhupāda,"Without canvassing, people join."
Guest (2):,"Guest (2):This is the fact here, see.",Prabhupāda,"And the world religion... TheRatha-yātrā, we did not ask any particular man. Everyone came and joined. You were there?"
Guest (1):,"Guest (1):No, I was not.",Prabhupāda,"Everyone came and joined. Everyone tookprasādam.And they were in Trafalgar Square from five to eight, continually. And Guardian published that..."
Devotee:,Devotee:Several pictures...,Prabhupāda,"""Rival to Nelson."" OurRatha-yātrāis rival to Nelson. Actually world religion. There is no doubt about it.Kṛṣṇais for everyone. And we have no restriction. They, so long they, our so-called Hindus, they restricted. But now this is open. (Hindi) [break]"
Guest (1):,"Guest (1):I think the article they got in a straight weekly mag... (indistinct) envy our national character. You know, there's envy, a lot of envy. If you are successful, or somebody is successful, everybody becomes jealous.",Prabhupāda,"So that we explain every day. This material life means to become jealous. That is material life. Material life means you are jealous of me, I am jealous of you."
