Question Speaker,Question Text,Answer Speaker,Answer Text
Devotee (1):,Devotee (1):Śuṣka-vairāgya.,Prabhupāda,"Śuṣka,śuṣkameans dry. Oh, it is material, I shall not touch. I shall not touch. Just like that rascal, Ramakrishna, if anyone wanted to give him some money (gesture). (laughter) How, he does not touch money. These rascals, why shall I not touch? Come on, you have got money, George Harrison, spend. Yes, come on, I shall take it, forKṛṣṇa. We haven't come to this house for living very comfortably and enjoying. No, we have come here for Kṛṣṇa's service."
Haṁsadūta:,Haṁsadūta:This point is revolutionary in spiritual circles.,Prabhupāda,"Because it is Kṛṣṇa's property. It is not my property, neither George's property. This is mistake. Everything belongs toKṛṣṇa. So it must be utilized forKṛṣṇa."
Revatīnandana:,Revatīnandana:Simply they don't knowBhagavad-gītā.,Prabhupāda,Eh?
Revatīnandana:,"Revatīnandana:They don't knowBhagavad-gītā, therefore they don't understand us.",Prabhupāda,"No, no. Therefore I say, all... Immediately, how you are all rascals. We have got a test. Test tube. As soon as one is notKṛṣṇaconscious, he is rascal, he is miscreant, he is lowest of the mankind, he has no knowledge. These, these are groups, they belong to.Namāṁduṣkṛtinomūḍhāḥprapadyantenarādhamāḥ.He maintains that he is very big man, Nixon, but we know that he is a rascal number one. This isKṛṣṇaconsciousness. You can understand immediately what is what. By this test:"
Revatīnandana:,"Revatīnandana:...you said if he's coming from God, then what difference does it make?",Prabhupāda,"You can see that you are a fool (but) God is not fool. That is the difference. But God is (indistinct), He'll not speak foolish. Because he is above all this foolishness but you are within the foolishness. That is the difference. Try to answer them like that. You are within the status of foolishness,māyā,and God is abovemāyā.If God is also within themāyā,as the rascal Māyāvādīs say, then what is the use of God? We are everything."
Yogeśvara,They just accumulate knowledge just for knowledge sake.,Prabhupāda,Not just for knowledge because they do not get any knowledge. They have no knowledge. What is the knowledge? They talk all nonsense. What is the knowledge?
Revatīnandana:,"Revatīnandana:His argument was ""Well there's no point in talking about this matter. All of us accept this."" He's saying: all big authorities, they accept this point of view, that this was recently written literature.",Prabhupāda,"No, they don't know who are authorities."
Revatīnandana:,Revatīnandana:That's right.,Prabhupāda,You manufacture your own authorities. You do not know. That is your misfortune. You do not know who is authority.
Revatīnandana:,"Revatīnandana:I met another old authority on Sanskrit and he is sitting behind his desk and his whole body is shaking: ""No, I'm not interested in the spiritual side of theseVedas.I'm just interested in the Sanskrit."" He's dying you know, and still he's like that. That's their authority. You can't save them but...",Prabhupāda,"Adhyaki, adhyaki(?),thereforeadhyaki(?)."
Revatīnandana:,Revatīnandana:What's that?,Prabhupāda,"External.Adhyaki(?).(indistinct) ...one is interested in the body not in the soul. So he is a fool. This, this sculptor, he is simply interested in the outward body, he has no knowledge of the soul. And he wants to become a very famous man, remaining in the category of asses. Because one who is in the bodily concept of life, he is an ass.Go-khara,kharameans ass.Saevago-kharaḥ[SB10.84.13]. Yasyātma-buddhiḥkuṇapetri-dhātuke[SB10.84.13].Anyone who is in the bodily concept of life he is no better than animal. The cats and dogs, they are also in the bodily concept of life.Saevago-kharaḥ[SB10.84.13].So he has not advanced beyond these cats and dogs because he is in the same conception, that I am this body. A dog cannot understand that you are not this body. So similarly, if the human being cannot understand that he is not this body, what is the difference between him and the dog? Sośāstrasayssaevago-kharaḥ:[SB10.84.13] he's no better than the cows and the asses. That's all. And actually it is a fact. The first instruction ofBhagavad-gītā, they cannot take it, and they're scholars. That is the most regrettable situation that these fools and rascals under the bodily concept of life, they are become authorities. Actually they are asses. Yes."
Revatīnandana:,"Revatīnandana:I used to observe when I was going to the university that all my professors, their intellectual business was just a profession like digging ditches.",Prabhupāda,That's all. For earning money.
Revatīnandana:,Revatīnandana:For their pleasure they're going home to drink beer and eat steak. That's all they're really interested in. They're just working to make money. I could see it and I didn't want to follow their footsteps.,Prabhupāda,"Just like aśūdra,he cleans in the road for money. They are going as professor but the category is the same. You don't make any distinction between that sweeper and this professor. Or a hog and cat and dog. The hog is also working hard, whole day and night for stool, eating. So this man is also working like that. Beyond that he has no other knowledge."
Revatīnandana:,"Revatīnandana:The scientists, they have a term. Psychologists, they call it theidiot savant.Theidiot savantmeans he's an idiot but he has one particular talent and because of that talent he can get along. Just like sometimes you find an idiot, he can look at a column of figures and he can compute the sum in his head very easily but he can't even understand how to tie his shoes. And I think these scholars are like that, they're actually idiots but they have one talent for Sanskrit or for history and because of that they can get along. They can support their body but otherwise they have no qualifications.",Prabhupāda,"Śūdra.Unless he gets that post, he'll starve. He has got some talent in some particular subject but he must get some service. By serving others, he'll be able to utilize his talent and get some money, then he'll eat. This isśūdra'sbusiness. Dog's business. Just like a dog unless he has got a nice master, his position is very precarious. A street dog. Nobody will care neither it is (indistinct)."
Yogeśvara,"You point out inŚrīmad-Bhāgavatamthat they go to school and learn to become Ph.D., then they have to knock on the door for a job and no one will open the door.",Prabhupāda,"No vacancy, sir. So just like dog."
Revatīnandana:,Revatīnandana:But they have a way to force them to work. The politicians force the scholars.,Prabhupāda,Yes.
Revatīnandana:,"Revatīnandana:If they don't print books, if they don't write a book every now and then and print it, get it published, they lose their tenure, their position as a professor. They must produce one book, then another book, then another book. If they don't, finished. In this way they are working all the time.",Prabhupāda,"The Marwaris in India, they don't educate their son. Just like Birla. They say, ""We can purchase these rascals, why we should waste our time. (laughter) So-called technicians, so-called expert computer, these are... We can purchase, why we shall waste our time."""
Haṁsadūta:,"Haṁsadūta:It's the same thing I learned in Germany. First I wanted to get my own press and I studied the situation very carefully and I saw it was ridiculous for us to do that, it's so much hard work. It's much easier to collect the money in the street by giving the magazine and then paying someone. They work very hard and do it. Everything is like that. They have so many people that can do everything. The one thing that people can't do is distributeKṛṣṇaconsciousness and for that Kṛṣṇa's giving so much money.",Prabhupāda,"Yes, thereforetasyaivahetoḥprayatetakovidaḥ.That verse. Only for this purpose one should endeavor."
Haṁsadūta:,Haṁsadūta:Yes.Kṛṣṇa(indistinct) paying for that.,Prabhupāda,You cannot purchaseKṛṣṇaconsciousness—you can have money—that you have to cultivate.
Revatīnandana:,"Revatīnandana:Yeah, when Mr. Birla is getting old then he has to come to us, if he has any sense.",Prabhupāda,"No they say, they simply give primary education (indistinct) they can read, that's all. And (indistinct). They don't send because everyone knows that sending boys to the school means spoil them. That's all. I have seen intelligent boys, they go to school and he is spoiled. Yes, spoiled. He learns how to smoke, how to have sex, how to talk nonsense, how to use knife, how to fight, these things. At least at the present moment. Yes. Simply slaughterhouse, this so-called school is called slaughterhouse. Yes, slaughterhouse."
Revatīnandana:,"Revatīnandana:It was when I went to school—I was a nice little boy—in school I failed out, only (indistinct).",Prabhupāda,"Yes, you must take as intelligent. That so..., time was wasted. Our, thisgurukulashould be taken care of very nicely. So nice preachers may come out.Brāhmaṇa,nicebrāhmaṇa."
Revatīnandana:,"Revatīnandana:I'm still thinking about the other morning, we were talking about how everything is actually spirit. Everything is composed of spiritual atoms actually, souls. We were talking about the...",Prabhupāda,"That is Vedic version,sarvaṁkhalvidaṁbrahma,everything isBrahman."
Revatīnandana:,"Revatīnandana:When we speak about the transmigration of the soul, we speak about 8,400,000 species. Does that include the inanimate objects as well, within those 8,400,000?",Prabhupāda,"Sthāvara,sthāvara,they are calledsthāvara,immovable. He means hills, mountains, stones. They are calledsthāvara.Sthāvara,which cannot move."
Revatīnandana:,Revatīnandana:So actually we don't really...,Prabhupāda,Sthāvarālakṣa-viṁśati.Two million types ofsthāvara.
Revatīnandana:,"Revatīnandana:So we don't actually discriminate between the tree, and say, the atom, as a living entity.",Prabhupāda,Yes.
Revatīnandana:,Revatīnandana:Haribol.Little by little it's becoming clear.,Prabhupāda,"Sthāvara,sthāvarameans one cannot move, standing.Sthāvara-jaṅgama.There are two kinds of living entities. One moving, one not moving."
Yogeśvara,But the atom is always in motion. The atoms and molecules are always constantly moving.,Prabhupāda,That movement is different. That is not independent movement.
Yogeśvara,Is that to say that a stone has a living entity in it?,Prabhupāda,Yes.
Revatīnandana:,"Revatīnandana:Actually what we discussed is that every, even the elements, the atoms, everything is made of nothing but spirit souls in fallen conditions. Because everything comes frombrahmajyoti,which is nothing but spirit souls, andbrahmajyoti...Therefore soul never changes. So this manifestation is frombrahmajyoti.Therefore, it is made of souls. It is nothing else but spirit souls. Yesterday, a few days ago we discussed that.",Prabhupāda,"It is simply covered by another energy which is called material energy. And that ismāyā.Māyāmeans that is not actual, not factual. The example is given, just like the sun is covered by the cloud. The cloud is nothing but another creation of sun. But when the cloud comes, sun is invisible. Similarly this condition, forgetfulness, is my creation and when I am covered by this forgetfulness I become stones and atoms, like that."
Haṁsadūta:,"Haṁsadūta:InBhagavad-gītā,it says that the soul is immovable. In the Second Chapter there is a verse that says the soul is immovable.",Prabhupāda,Yes.
Haṁsadūta:,Haṁsadūta:What does that mean exactly? Are we not moving? In that verse it says immovable and...,Prabhupāda,"Sthāṇu,means fixed up."
Haṁsadūta:,Haṁsadūta:You mean its nature is...?,Prabhupāda,Unchangeable.
Haṁsadūta:,Haṁsadūta:Unchangeable. Not that we are not moving. We are moving.,Prabhupāda,"Might be that word was not properly used.Sthāṇu,the word issthāṇu.If you have got Sanskrit, you know what is the meaning ofsthāṇu.Andacalo 'yam, acalo 'yam,yes."
Revatīnandana:,Revatīnandana:The point of all those...,Prabhupāda,"That meansacalo 'yamalso, soacalo 'yam. Acalo 'yammeans that does not move.Sthāṇur acalo 'yam,in theBhagavad-gītāit is given. You can see. Now there is no time."
Revatīnandana:,Revatīnandana:It's time for class. (end),Prabhupāda,"...recently I've heard that the people in the airport protested against IndiraGandhi, that ""Give us rain."" Yes. That is Vedic civilization ideal. Why there is rain then no rain? The king should be responsible. Onebrāhmaṇalost his son. He immediately went to the king and asked him that ""The son has died before the death of the father; why this irregularity? You are responsible."" You see? The ideal is that the king is representative of God, because we are all sons of God. We have come here in this material world for our proper guidance. The king is responsible, the spiritual master is responsible, the father is responsible, the elderly persons are responsible. Because you told me that we have to work for other. That other isKṛṣṇa. If we utilize our intelligence for servingKṛṣṇaunder the guidance of the king or the spiritual master or the father, then the society is perfect. That is ideal civilization. What is your opinion about this? How do you think this ideal..."
David Wynne:,David Wynne:I think it's... I... I... I wonder when it will come. Will it come on this level or what...?,Prabhupāda,"Immediately, provided you take toKṛṣṇaconsciousness."
David Wynne:,David Wynne:Yes.,Prabhupāda,"Immediately. It is not a question of when. Just like here is light. It doesn't depend there is darkness. You can remain in the darkness and immediately come to the light, and from the light immediately go to the darkness. So, this darkness and light, they are existing, co-existing. It is my choice whether to remain in the darkness or in the light. It is my choice. As soon as you are in the darkness, there is no light. As soon as you are in light, there is no darkness. It is your choice. And thisKṛṣṇaconsciousness is light. And anything else, that ismāyā.So we can accept eithermāyāorKṛṣṇa. If you take tomāyā,then you've spoiled your energy and time. If you take toKṛṣṇa, you utilize your energy and time. Everything is there, ready. You haven't got to create. Everything is there. Just like night is there and day is there. You can keep yourself always in day. Do you know how to do it?"
David Wynne:,"David Wynne:Keep going round, I suppose. (devotees laugh)",Prabhupāda,"Yes. Nowadays it is not difficult, because..."
Devotee (1):,Devotee (1):Airplane.,Prabhupāda,"Just like I started from India at eleven o'clock, and I came here at half past eight, the sunlight was still there. So if you proceed still further, further towards Western side, the night will not be able to come. So you can travel always in daylight. (laughs) Don't allow. It is an example."
David Wynne:,David Wynne:Why do we choose the dark?,Prabhupāda,Eh?
David Wynne:,"David Wynne:Why do we all choose the dark? Why are we all in the dark, most of us?",Prabhupāda,Dark means withoutKṛṣṇaconsciousness—darkness.
David Wynne:,David Wynne:And most people.,Prabhupāda,Due to bad association.
David Wynne:,David Wynne:To...?,Prabhupāda,Bad association.
David Wynne:,David Wynne:Ah.,Prabhupāda,"Therefore, our Society is association. If we keep good association, then we don't touch the darkness. What is that association? There is a song,sat-saṅgacarigoinuasatevilāsateka namelagilomakarmabandhaphāṅsa.(?)Sat-saṅga.Sat-saṅgameans association with the devotees. That is calledsat-saṅga.So the, one poet,Vaiṣṇavapoet, is regretting that ""I did not keep association with the devotees, and I wanted to enjoy life with the nondevotees. Therefore I'm being entangled in the fruitive activities.""Karmabandhaphāṅsa.Entanglement. Here in this material world we act, and the result is there. Again we enjoy the result and act, again another result. We act, another result, another result. Because as soon as you act, there will be some result, good or bad. So, good or bad, by good result we get good birth, good money, good bodily features, good education—these are the effects of good work. And the effects of bad work, low-grade family, abominable, ugly bodily features, no education, no money, poor—these are the two effects of material good and bad work. But those who are trying to be transcendental both to the good and bad work, devotees, they are perfect. Because in this material world either you do good work or bad work, you have to suffer the material condition. Just like you are, suppose you are Englishman, you are well situated. But you can not avoid the influence of the weather. (laughs)"
David Wynne:,David Wynne:No.,Prabhupāda,"That is our problem. Either you become rich man or poor man, but you have to undergo. (aside:) Make the light. There is switch. (pause) So our position is that we are in this material world. George has sung that ""I am in the material world."" Yes, very sensible song. (laughs) He's good boy, realizing, he also... So this material life is not good. Material life is not good in this sense, because you have to change your body. Sometimes good birth, sometimes not good birth. Sometimes Englishman, sometimes cats, dogs. Because after death you'll get a body that will be chosen not by you but by the material nature. You'll create your body by your present activities, and nature will simply award you that body. So, so long we have got this material body, the four kinds of miserable conditions, repetition of birth, death, old age and disease, you have to suffer. Therefore, this human life should be utilized in such a way that we do not become subject to these four tribulations, birth, death, old age and disease. That is perfection. But people are not given that chance, the modern education, modern civilization. They've no knowledge; they do not know that there is life after death, although it is a simple fact. Just like in our present existence we have got past, present and future. Just like you are young man, you have your past. You are a child, or a boy, now that is past. Present, you are young man, and in future you are expecting to become old man. So as you have got past, present and future, similarly, I'm old man, I've got my past life, why not future? What is the reason to deny it? Past, present, future, that is the time calculation. I had my past, I've now present, and why is my future? They do not care for the future. They're so blind. There must be future. So what I'm doing for the future? Just like in this life we collect some money, keep in the bank balance so that in future, old age, I may not be in difficulty. Similarly, what a human being should do for his future life? That he does not know, although past, present, future is there. So this is foolishness. He doesn't care for the future. So one who is foolish, without any knowledge of the future, whatever he's doing is defeated—in ignorance, because it is ignorance. Just like a boy does not take education, does not think of future. That is not very good. We must be prepared for the future, his next life. Yes, where is that civilization? Where is that education, that people are thinking for future life? Is there any educational system at the present moment? So everything is being defeated.Parābhavas tāvadabodha-jātoyāvannajijñāsataātma-tattvam.Abodha-jāta,these rascal fools, born foolish. He does not inquire about the self-realization, so whatever he is doing, it is all defeat, he is spoiling his time, because he does not know.Ātma-tattvam,the science of self-realization. So in ignorance, whatever you do there is defeat. And they're being defeated and they're thinking ""I'm victorious."" This is calledmāyā.This is calledmāyā.So thisKṛṣṇaconsciousness movement is very scientific. We are trying to save the living entity from disastrous condition. This is the aim and mission ofKṛṣṇaconsciousness. It is not a religious sentiment, no. It is a very scientific. And we have got so many books already printed, and many books coming. Each and every one. You have seen our books?"
Devotee (2):,Devotee (2):Bhagavad-gītāhe has seen.,Prabhupāda,"If you read carefully, each and all carries volumes of meaning.David Wynne:Yes. Yes."
Devotee (2):,Devotee (2):He's got theBhagavad-gītāthat the Queen was reading.,Prabhupāda,Ah.
Devotee (2):,Devotee (2):She was looking at...,Prabhupāda,"Bhagavad-gītā,ourBhagavad-gītā?"
Devotee (2):,"Devotee (2):Yes. Queen Elizabeth was looking, and she gave...",Prabhupāda,"Yes, as far as possible you should help everyone how to be, how to become enlightened about his future. That is real humanitarian work—to save a human being from the future disastrous condition of life. Just like a father thinks of his son, that he may not be unhappy in his future life. So it is the duty of the king, it is the duty of the father, it is the duty of the spiritual master to see that his subordinate is not falling a victim of future disastrous life."
David Wynne:,"David Wynne:Yes, she said, ""How marvelous it would be to completely trustKṛṣṇa.""",Prabhupāda,That's very nice.
David Wynne:,"David Wynne:She said, ah, ""What a relief to be able to pass all responsibility toKṛṣṇa.""",Prabhupāda,"Yes. But that one has to learn, how to surrender toKṛṣṇa. The sentiment is very nice. It is just fitting from the royal... Because she's after all favored, she has taken birth in the royal family, so she is not ordinary woman. And her intelligence must be extraordinary. So she has remarked like that, what is that exact word?"
David Wynne:,"David Wynne:I think the exact word... She said ""How marvelous to be able to give all responsibility toKṛṣṇa.""",Prabhupāda,Yes.Kṛṣṇais ready.
David Wynne:,David Wynne:Yes. And she said...,Prabhupāda,But the thing is from our sideKṛṣṇaexpects something.
David Wynne:,David Wynne:(laughs),Prabhupāda,"Kṛṣṇais not a dead stone. Reciprocal. If you fully surrender toKṛṣṇa, thenKṛṣṇatakes full responsibility. If you keep some reservation,Kṛṣṇaalso keep reservation."
David Wynne:,David Wynne:Yeah.,Prabhupāda,"This is it. WhenKṛṣṇaunderstands that you have fully surrendered, He takes full responsibility. That is stated in theBhagavad-gītā:"
Devotee (1):,"Devotee (1):Sometimes people ask, ""If I surrender to God, give everything to God, then how will the state go on, how will the work, the factories, how would all that go on?",Prabhupāda,"That,Kṛṣṇais taking responsibility.Kṛṣṇasays,ahaṁtvāṁsarva-pāpebhyomokṣayiṣyāmi.He takes responsibility. Otherwise what is the use of surrender untoKṛṣṇa? He takes responsibility."
Devotee (1):,"Devotee (1):(laughs) Just can't go wrong, then.",Prabhupāda,"No.Kṛṣṇasaysahaṁtvāṁsarva-pāpebhyomokṣayiṣyāmi.ActuallyKṛṣṇais doing everything. We are thinking, ""I'm doing it."" We are doing nothing. Just like he has become a famous sculptor. Why you could not? Why, what is the reason?Sarvasyacāhaṁhṛdisanniviṣṭaḥ[Bg.15.15].""I am seated in everyone's heart."" When He works,Kṛṣṇasays, ""Do like this; it will be perfect like this."" SoKṛṣṇais guiding. And everyone is being guided byKṛṣṇa, even in this condition of life. And when he fully surrenders, how much guidance he will come his way? Even without surrender he's guided. Without His guidance he can not do it."
David Wynne:,David Wynne:That's true.,Prabhupāda,"You cannot do it. Cannot do anything.Sarvasyacāhaṁhṛdisanniviṣṭomattaḥsmṛtirjñānamapohanaṁca[Bg.15.15].Kṛṣṇais guiding everyone, even an ant.Kṛṣṇais giving information, ""Mr. Ant, there is a grain of sugar, you can go there."" Immediately goes. Otherwise, how he gets the information? For him, one hundred miles away, a grain of sugar, and he goes there. He did not inform. Who informs him? Who informed him?"
David Wynne:,"David Wynne:You feel this very much when one's trying to make sculpture, because it is impossible for a man; one can't do it...",Prabhupāda,No.
David Wynne:,David Wynne:...one has to wait and be passive...,Prabhupāda,"IfKṛṣṇawithdraws the intelligence, you cannot work. SoKṛṣṇais guiding already, but He's guiding at the present moment according to your whims. ""You wanted to do this? All right.""Kṛṣṇais giving intelligence: ""Do it."" But when he'll agree to act according to the whims ofKṛṣṇa, that is perfection."
David Wynne:,David Wynne:How do you agree to this?,Prabhupāda,Eh?
David Wynne:,David Wynne:How does one agree to this?,Prabhupāda,There is process.
